supermarket,category,name,description,price,reference_price,reference_unit,insert_date
885EA3C1F14BDAE3193991E63BF5CFA4,marisco_y_pescado_salazones_y_ahumados,Mojama de atún superior en taco Ubago,Paquete,5.8,29.0,kg,2021-01-25 00:00:00
ADCA3FE6444F01A88B191BBCD4249311,alimentacion_legumbres_lentejas_cocidas,DIA lentejas cocidas frasco 400 gr,,0.69,1.72,€/Kg.,2020-11-08 12:00:00
433463D95980C252B92C204E3655BB81,bebidas_aguas_y_zumos_zumos_refrigerados,"Smoothie de naranja, zanahoria, manzana ecológico Be Green botella 30 cl.",30 Cl.,3.05,10.17,l,2020-12-12 00:00:00
433463D95980C252B92C204E3655BB81,limpieza_y_hogar_cuidado_de_la_ropa_suavizantes,Suavizante concentrado magia de magnolia Aromaterapia Vernel 76 lavados.,,3.25,0.04,lavado,2020-12-30 12:00:00
433463D95980C252B92C204E3655BB81,la_despensa_dulce_y_desayuno_mermeladas_membrillos_y_compotas,Mermelada de arándano categoría extra Carrefour 410 g.,,1.26,3.07,kg,2021-01-05 12:00:00
ADCA3FE6444F01A88B191BBCD4249311,lacteos_y_huevos_mantequilla_y_margarina_mantequilla,ASTURIANA mantequilla ligera sin lactosa barqueta 250 gr,,2.09,8.36,€/Kg.,2020-10-22 12:00:00
ADCA3FE6444F01A88B191BBCD4249311,mascotas_gatos_alimento_humedo,AS Mix gourmet alimento para gatos con carne tarro 4 x 85 gr,,1.66,4.88,€/Kg.,2020-12-07 12:00:00
ADCA3FE6444F01A88B191BBCD4249311,especial_navidad_dulces_navidad_turron_duro_tortas,DIA DULCE NOEL palitos de turrón caramelo chocolate caja 140 gr,,3.59,25.64,€/Kg.,2020-11-19 12:00:00
433463D95980C252B92C204E3655BB81,la_despensa_alimentacion_salsas_y_tomate_frito,Salsa roquefort ensaladas y carnes Ybarra sin gluten tarro 300 g.,300 G.,1.85,6.17,kg,2020-11-05 12:00:00
433463D95980C252B92C204E3655BB81,bebe_alimentacion_infantil_postres_zumos_petit_y_yogures_infantiles,Postre lácteo natural desde 6 meses Nestlé Yogolino sin gluten sin aceite de palma pack de 8 unidades de 100 g.,Pack 8x100 G.,4.09,5.11,kg,2020-07-27 17:36:00
433463D95980C252B92C204E3655BB81,bebidas_refrescos_colas,"Coca Cola zero azúcar botella 1,25 l.","1,25 L.",1.25,1.0,l,2020-12-13 01:00:00
433463D95980C252B92C204E3655BB81,el_mercado_verduras_y_hortalizas_congelados_en_verduras_y_hortalizas,Guisantes Carrefour 1 kg.,1 Kg.,1.13,1.13,kg,2020-10-29 13:00:00
433463D95980C252B92C204E3655BB81,mascotas_gatos_accesorios_e_higiene,Arenero con Borde Protector para Gatos,,9.95,9.95,ud,2021-01-09 12:00:00
433463D95980C252B92C204E3655BB81,bebidas_cerveza_rubia,Cerveza Voll Damm doble malta botella 33 cl.,33 Cl.,1.1,3.33,l,2020-10-23 12:00:00
ADCA3FE6444F01A88B191BBCD4249311,desayuno_dulces_y_pan_bolleria_pastelitos_y_donuts,DONUTS bombón estuche 2 uds 94 gr,,1.39,14.79,€/Kg.,2020-09-29 00:00:00
433463D95980C252B92C204E3655BB81,la_despensa_dulce_y_desayuno_miel,Miel de eucalipto Carrefour 500 g.,500 G.,3.55,7.1,kg,2020-07-21 17:51:00
433463D95980C252B92C204E3655BB81,la_despensa_aperitivos_frutos_secos,Almendras tostadas con piel Wonderful 200 g.,200 G.,4.0,20.0,kg,2020-11-01 12:00:00
ADCA3FE6444F01A88B191BBCD4249311,drogueria_y_limpieza_limpiadores_para_el_hogar_limpia_inodoro_wc,DIA block wc líquido aroma ocean colgador + recambio 1 ud,,0.99,0.99,€/ud.,2020-09-17 16:00:00
433463D95980C252B92C204E3655BB81,bebidas_refrescos_tonica,Tónica Schweppes Original pack de 12 latas de 25 cl.,Pack 12x25 Cl.,7.02,2.34,l,2020-10-28 12:00:00
433463D95980C252B92C204E3655BB81,el_mercado_quesos_azules_y_roquefort,Queso azul Silver Lazur sin gluten y sin lactosa 100 g.,,2.0,20.0,kg,2020-12-23 12:00:00
433463D95980C252B92C204E3655BB81,bebidas_vinos_todos_los_vinos,Vino tinto crianza tempranillo Dehesas del Rey D.O. Ribera del Duero 75 cl.,,7.0,7.0,ud,2021-01-08 00:00:00
ADCA3FE6444F01A88B191BBCD4249311,lacteos_y_huevos_horchatas_horchatas,DIA bífidus de kiwi 0% M.G pack 4 unidades 125 gr,,0.99,1.98,€/Kg.,2020-12-12 12:00:00
433463D95980C252B92C204E3655BB81,parafarmacia_cuidado_e_higiene_facial_desmaquillantes,Desmaquillante de ojos fisiológico La Roche-Posay 125 ml.,,12.0,9.6,100ml,2021-01-24 12:00:00
433463D95980C252B92C204E3655BB81,el_mercado_quesos_gouda_y_emmental,Queso gouda holland en lonchas Carrefour 200 g.,,1.13,5.65,kg,2020-12-30 12:00:00
433463D95980C252B92C204E3655BB81,perfumeria_e_higiene_boca_y_sonrisa_cepillos_recambios_y_accesorios,Cepillo de dientes medio max white Colgate 2 ud.,,2.95,2.95,ud,2020-12-23 12:00:00
433463D95980C252B92C204E3655BB81,limpieza_y_hogar_papeleria_marcadores,Marcadores Bic Marking Pastel,5 Ud.,5.9,1.18,ud,2020-11-06 00:00:00
433463D95980C252B92C204E3655BB81,el_mercado_quesos_anejo,"Queso puro de oveja graso reserva Boffard cuña 1/4, 700 g",Cuña De  700.0 G. Aprox,12.25,17.5,kg,2020-11-13 00:00:00
ADCA3FE6444F01A88B191BBCD4249311,alimentacion_salsas_mayonesa,CALVE mayonesa casera frasco 430 ml,,1.75,4.07,€/l.,2020-12-29 00:00:00
433463D95980C252B92C204E3655BB81,la_despensa_lacteos_bebida_vegetal,Bebida de arroz ecológica Soria Natural con canela al limón brik 1 l.,1 L.,3.0,3.0,l,2020-11-12 12:00:00
ADCA3FE6444F01A88B191BBCD4249311,bebidas_vinos_tintos_mesa,CUMBRES DE GREDOS vino tinto envase 1 lt,,1.45,1.45,€/l.,2021-01-01 12:00:00
433463D95980C252B92C204E3655BB81,bebidas_cerveza_rubia,Cerveza Alhambra tradicional pack de 12 latas de 33 cl.,,6.72,1.7,l,2021-01-26 00:00:00
433463D95980C252B92C204E3655BB81,bebidas_vinos_blanco,Vino D.O. Rías Baixas blanco albariño Pazo das Estrelas 75 cl.,75 Cl.,7.0,7.0,ud,2020-10-10 12:00:00
433463D95980C252B92C204E3655BB81,mascotas_gatos_premios_y_snacks,Purina Gourmet Gold Comida Húmeda para Gato Tartalette Buey y Tomate 85g,,0.69,8.12,kg,2021-01-13 12:00:00
433463D95980C252B92C204E3655BB81,limpieza_y_hogar_productos_para_bano_wc,Limpiador de baño 5 en 1 en gel Pato pack de 2 unidades de 750 ml.,,3.59,0.24,100ml,2021-01-02 12:00:00
433463D95980C252B92C204E3655BB81,la_despensa_helados_tarrinas,Helado sorbete de limón Nestlé La Lechera sin gluten y sin lactosa 1 l.,1 L.,3.1,4.38,kg,2020-12-14 12:00:00
885EA3C1F14BDAE3193991E63BF5CFA4,maquillaje_ojos,Sombra de ojos mate Deliplus 13,,3.0,3.0,ud,2020-09-14 04:19:00
433463D95980C252B92C204E3655BB81,bebidas_aguas_y_zumos_zumos_no_refrigerados,Bebida de fruta piña y coco Granini Selección Mix botella 1 l.,1 L.,2.1,2.1,l,2020-11-03 00:00:00
433463D95980C252B92C204E3655BB81,la_despensa_alimentacion_aceites_y_vinagres,Aceite de oliva intenso 1º Carrefour 1 l.,,2.28,2.28,l,2021-01-12 09:00:00
433463D95980C252B92C204E3655BB81,la_despensa_alimentacion_salsas_y_tomate_frito,Tomate frito Carrefour pack de 3 briks de 390 g.,,0.99,0.85,kg,2020-12-31 00:00:00
433463D95980C252B92C204E3655BB81,el_mercado_quesos_todos_los_quesos,Queso rulo de cabra Sant Maure 180 g,Pieza De,3.0,16.67,kg,2020-12-06 01:00:00
433463D95980C252B92C204E3655BB81,bebidas_cerveza_tostada__roja,Cerveza tostada Estrella Galicia 0.0 alcohol pack 6 botellas 25 cl.,,4.1,2.73,l,2020-09-25 12:00:00
433463D95980C252B92C204E3655BB81,limpieza_y_hogar_menaje_utensilios_de_cocina,"Set de 2 Fuentes Horno CARREFOUR HOME 5,7 l - Transparente",2 Ud.,5.9,5.9,ud,2020-10-10 12:00:00
433463D95980C252B92C204E3655BB81,la_despensa_yogures_y_postres_bifidus,Yogur bífidus desnatado con frutos rojos Danone Activia pack de 4 unidades de 120 g.,Pack 4x120 G.,2.09,4.35,kg,2020-11-24 10:00:00
433463D95980C252B92C204E3655BB81,bebidas_cerveza_artesanas,Cerveza artesana Ordio Minero Skunk Diaple IPA botella 33 cl.,33 Cl.,2.25,6.82,l,2020-12-14 00:00:00
885EA3C1F14BDAE3193991E63BF5CFA4,fitoterapia_y_parafarmacia_fitoterapia,Batido sabor chocolate y galletas Deliplus sustitutivo,Caja,5.5,2.18,100 g,2020-08-12 16:00:00
433463D95980C252B92C204E3655BB81,el_mercado_quesos_gouda_y_emmental,Queso de vaca tierno edam Carrefour 350 g aprox,,2.23,6.37,kg,2021-01-25 12:00:00
433463D95980C252B92C204E3655BB81,bebidas_aguas_y_zumos_zumos_no_refrigerados,Zumo tropical zero sin azúcar añadido Bifrutas sin gluten pack de 3 briks de 330 ml.,Pack 3x33 Cl.,1.61,1.63,l,2020-11-15 00:00:00
885EA3C1F14BDAE3193991E63BF5CFA4,panaderia_y_pasteleria_tartas_y_pasteles,Tarta de galleta 5 Hacendado congelada,,7.5,20.83,kg,2020-08-23 04:00:00
433463D95980C252B92C204E3655BB81,perfumeria_e_higiene_cuidado_y_proteccion_corporal_body_milk_hidratacion_bajo_la_ducha,"Crema hidratante de manos, cara y cuerpo Nivea 300 ml.",,4.51,1.5,100ml,2021-01-20 12:00:00
433463D95980C252B92C204E3655BB81,limpieza_y_hogar_menaje_ordenacion,Caja con Tapa de Plástico  CARREFOUR HOME Basic  2 l- Transparente,1 Ud,1.5,1.5,ud,2020-12-14 12:00:00
885EA3C1F14BDAE3193991E63BF5CFA4,cereales_y_galletas_galletas,Galletas Minis Hacendado,Caja,1.75,3.5,kg,2020-07-30 04:00:00
885EA3C1F14BDAE3193991E63BF5CFA4,aceite_especias_y_salsas_mayonesa_ketchup_y_mostaza,Mayonesa Hacendado,Bote,0.8,2.67,L,2020-11-03 00:00:00
885EA3C1F14BDAE3193991E63BF5CFA4,panaderia_y_pasteleria_pan_de_molde_y_otras_especialidades,"Hogaza de espelta 38% y centeno 25% con semillas de quinoa 1,9% & chía 1,3%",,1.3,3.82,kg,2020-08-03 04:00:00
433463D95980C252B92C204E3655BB81,la_despensa_dulce_y_desayuno_cafes,Café con leche en cápsulas Nescafé Dolce Gusto 60 ud.,60 Ud.,15.3,51.0,kg,2020-10-22 12:00:00
885EA3C1F14BDAE3193991E63BF5CFA4,postres_y_yogures_bifidus,Bífidus desnatado de piña Hacendado 0% materia grasa 0% sin azúcares añadidos,Pack-4,0.95,1.9,kg,2020-11-28 12:00:00
ADCA3FE6444F01A88B191BBCD4249311,lacteos_y_huevos_yogures_soja,ALPRO yogur natural de soja con coco vaso 500 gr,,2.09,4.18,€/Kg.,2021-01-19 12:00:00
433463D95980C252B92C204E3655BB81,la_despensa_conservas_sopas_y_precocinados_conservas_de_pescado_y_marisco,Trozos de tentáculos de potón en salsa gallega Noly 72 g.,90 G.,1.28,17.78,kg,2020-11-09 12:00:00
433463D95980C252B92C204E3655BB81,el_mercado_panaderia_bolleria_y_pasteleria_magdalenas_dulces_y_bollos,Baklava mixto bandeja 300 g,300 G,5.95,19.83,kg,2020-12-01 12:00:00
ADCA3FE6444F01A88B191BBCD4249311,bebe_higiene_toallitas,KANDOO toallitas wc sensitive envase 100 uds,,5.39,0.05,€/ud.,2020-08-21 16:00:00
433463D95980C252B92C204E3655BB81,la_despensa_dulce_y_desayuno_galletas,Galletas Digestive Carrefour 800 g.,,1.1,1.37,kg,2021-01-06 12:00:00
885EA3C1F14BDAE3193991E63BF5CFA4,panaderia_y_pasteleria_pan_de_horno,"Panecillo de ajo 1,2%",,0.22,0.85,100 g,2021-01-16 00:00:00
ADCA3FE6444F01A88B191BBCD4249311,bebidas_vinos_tintos_galicia,BERONIA vino tinto crianza DO Rioja botella 75 cl,,7.39,9.85,€/l.,2021-01-22 12:00:00
885EA3C1F14BDAE3193991E63BF5CFA4,cuidado_facial_y_corporal_perfume_y_colonia,Eau de toilette hombre Como tú Aventura,Frasco,7.0,7.0,100 ml,2020-08-25 04:00:00
433463D95980C252B92C204E3655BB81,la_despensa_conservas_sopas_y_precocinados_conservas_de_pescado_y_marisco,Anchoas en aceite de oliva virgen extra ecológico Consorcio 38 g.,38 G.,3.6,94.74,kg,2020-11-24 10:00:00
433463D95980C252B92C204E3655BB81,bebidas_alcoholes_todos_los_alcoholes,Vodka Smirnoff 1 l.,1 L.,12.55,12.55,l,2020-11-24 19:00:00
433463D95980C252B92C204E3655BB81,limpieza_y_hogar_utensilios_de_limpieza_escobas_mopas_y_recogedores,Cepillo Multiusos 3in1 antichoque VILEDA  - Rojo,,5.1,5.1,ud,2020-12-26 12:00:00
ADCA3FE6444F01A88B191BBCD4249311,frescos_verdura_y_hortalizas_zanahorias_y_otras_raices,Zanahoria tierna bandeja 500gr,,0.99,1.98,€/Kg.,2020-11-16 12:00:00
885EA3C1F14BDAE3193991E63BF5CFA4,panaderia_y_pasteleria_bolleria_envasada,Mini croissant bañado al cacao Hacendado,Paquete,0.9,4.86,kg,2020-12-28 12:00:00
ADCA3FE6444F01A88B191BBCD4249311,congelados_y_helados_pescado_y_marisco_pescado,PESCANOVA lomos de merluza caja 360 gr,,4.49,12.47,€/Kg.,2020-12-03 12:00:00
433463D95980C252B92C204E3655BB81,bebidas_cerveza_todas_las_cervezas,Cerveza 1906 reserva especial pack 12 botellas 33 cl.,,11.47,2.9,l,2021-01-11 12:00:00
433463D95980C252B92C204E3655BB81,la_despensa_conservas_sopas_y_precocinados_platos_preparados,Tortilla pockets kit Old El Paso sin lactosa 375 g.,375 G.,6.35,6.35,ud,2020-12-06 01:00:00
433463D95980C252B92C204E3655BB81,el_mercado_quesos_todos_los_quesos,Queso tierno en lonchas Carrefour 200 g.,,1.45,7.25,kg,2021-01-19 12:00:00
885EA3C1F14BDAE3193991E63BF5CFA4,limpieza_y_hogar_limpieza_cocina,Crema abrillantadora acero inoxidable y aluminio Bosque Verde,Botella,2.25,4.5,L,2020-10-18 00:00:00
885EA3C1F14BDAE3193991E63BF5CFA4,cacao_cafe_e_infusiones_cafe_soluble_y_otras_bebidas,Café soluble cappuccino descafeinado Nescafé Gold,Bote,3.53,14.12,kg,2020-12-02 12:00:00
433463D95980C252B92C204E3655BB81,bebidas_vinos_tinto,"Vino D.O. Rioja tinto crianza Cune 37,5 cl.","37,5 Cl.",4.25,4.25,ud,2020-10-25 12:00:00
433463D95980C252B92C204E3655BB81,bebidas_cerveza_todas_las_cervezas,Cerveza artesana La Cibeles rubia botella 33 cl.,33 Cl.,2.2,6.67,l,2020-10-19 12:00:00
433463D95980C252B92C204E3655BB81,la_despensa_conservas_sopas_y_precocinados_croquetas_y_rebozados,Buñuelos de Bacalao Carrefour 400 g.,400 G.,2.0,5.0,kg,2020-11-19 12:00:00
885EA3C1F14BDAE3193991E63BF5CFA4,fitoterapia_y_parafarmacia_parafarmacia,Gel de manos higienizante sin aclarado Deliplus 70% alcohol,Bote,1.85,1.85,100 ml,2021-01-25 12:00:00
433463D95980C252B92C204E3655BB81,la_despensa_dulce_y_desayuno_dulces_y_golosinas,Nubes de goma Fini sin gluten 150 g.,150 G.,1.71,11.4,kg,2020-12-04 12:00:00
433463D95980C252B92C204E3655BB81,el_mercado_charcuteria_foie_pates_y_sobrasadas,Paté de oca superior Martiko pack de 2 unidades de 75 g.,,2.7,18.0,kg,2021-01-16 00:00:00
433463D95980C252B92C204E3655BB81,la_despensa_huevos_huevos_frescos,Huevos L suelo El Granjero 12 ud.,Blister 12 Ud.,1.85,1.85,docena,2020-11-27 12:00:00
885EA3C1F14BDAE3193991E63BF5CFA4,panaderia_y_pasteleria_bolleria_de_horno,Xuxu relleno de crema 49%,Pieza,0.43,8.43,kg,2020-12-05 00:00:00
ADCA3FE6444F01A88B191BBCD4249311,drogueria_y_limpieza_conservacion_alimentos_film_transparente,ALBAL film transparente corte fácil 20 m,,1.85,0.09,€/m.,2021-01-15 12:00:00
433463D95980C252B92C204E3655BB81,la_despensa_conservas_sopas_y_precocinados_pizzas,Mini pizzas de jamón y queso Carrefour 270 g.,270 G.,1.88,6.96,kg,2020-11-26 00:00:00
433463D95980C252B92C204E3655BB81,limpieza_y_hogar_bazar_automovil,Batería de Moto 12V 6AH Carrefour,,29.95,29950.0,ud,2020-11-30 00:00:00
885EA3C1F14BDAE3193991E63BF5CFA4,cereales_y_galletas_galletas,Galletas rellenas de chocolate Hacendado 0% azúcares añadidos,Paquete,0.75,4.87,kg,2020-08-14 04:00:00
433463D95980C252B92C204E3655BB81,el_mercado_quesos_todos_los_quesos,Queso en porciones La Vaca que ríe 125 g.,125 G.,1.41,11.28,kg,2020-11-13 00:00:00
433463D95980C252B92C204E3655BB81,perfumeria_e_higiene_cuidado_y_proteccion_corporal_body_milk_hidratacion_bajo_la_ducha,Crema hidratante intensiva Soft Nivea 100 ml.,100 Ml.,2.2,2.2,100 ml,2020-11-15 00:00:00
ADCA3FE6444F01A88B191BBCD4249311,bebidas_isotonicas_y_energeticas_energeticas,RED BULL bebida energética sin azúcar lata 25 cl,,1.29,5.16,€/l.,2020-11-19 12:00:00
885EA3C1F14BDAE3193991E63BF5CFA4,agua_y_refrescos_tonica_y_bitter,Tónica Nordic Mist,Lata,2.32,1.16,L,2020-08-02 16:00:00
433463D95980C252B92C204E3655BB81,la_despensa_alimentacion_arroz_y_cous_cous,Cuscús grano mediano Gallo 500 g.,500 G.,1.42,2.84,kg,2020-12-13 12:00:00
433463D95980C252B92C204E3655BB81,bebidas_vinos_todos_los_vinos,Vino D.O. Ribera del Duero tinto Tres Reinos 75 cl.,75 Cl.,3.05,3.05,ud,2020-11-02 01:00:00
433463D95980C252B92C204E3655BB81,perfumeria_e_higiene_cosmetica_labios,Barra de labios Lasting Finish nº 101 Kate Rimmel 1 ud.,,7.1,7.1,ud,2021-01-25 12:00:00
885EA3C1F14BDAE3193991E63BF5CFA4,bebe_biberon_chupete_y_menaje,Biberón 270 ml tetina silicona tres posiciones +1 mes Deliplus,,3.2,3.2,ud,2021-01-26 12:00:00
433463D95980C252B92C204E3655BB81,perfumeria_e_higiene_cuidado_y_proteccion_corporal_piel,Crema de manos intensiva con aceite de almendras Nivea 100 ml.,,2.85,2.85,100ml,2021-01-14 00:00:00
433463D95980C252B92C204E3655BB81,bebidas_cava_y_champagne_todos_los_cavas_y_champagnes,Cava ecológica + Natura brut nature reserva 75 cl.,75 Cl.,6.65,6.65,ud,2020-10-17 12:00:00
433463D95980C252B92C204E3655BB81,parafarmacia_bebe_leche_infantil,Leche infantil de continuación desde 6 meses Nutriben Innova 2 lata 800 g.,,18.7,23.37,kg,2020-12-26 12:00:00
433463D95980C252B92C204E3655BB81,perfumeria_e_higiene_cosmetica_ojos,Perfilador de ojos nº 001 24h. ScandalEyes Rimmel 1 ud.,,6.1,6.1,ud,2021-01-10 00:00:00
ADCA3FE6444F01A88B191BBCD4249311,bebidas_alcoholes_y_licores_whisky_y_bourbon,JACK DANIELS whisky tenessee botella 70 cl,,19.65,28.07,€/l.,2020-12-11 00:00:00
885EA3C1F14BDAE3193991E63BF5CFA4,panaderia_y_pasteleria_pan_tostado_y_rallado,Panecillo tostado classic Hacendado,Paquete,0.78,2.6,kg,2020-11-15 00:00:00
433463D95980C252B92C204E3655BB81,bebidas_refrescos_gaseosa,"Soda Geiser sifón 1,5 l.","1,5 L.",1.52,1.01,l,2020-11-02 01:00:00
ADCA3FE6444F01A88B191BBCD4249311,lacteos_y_huevos_yogures_yogur_natural_desnatado,PASTORET yogur natural desnatado artesano 0% M.G. tarrina 125 gr,,0.69,5.52,€/Kg.,2020-08-01 04:00:00
885EA3C1F14BDAE3193991E63BF5CFA4,carne_aves_y_pollo,Chuletas de pavo contramuslo,Bandeja,2.45,4.9,kg,2020-09-26 00:11:00
433463D95980C252B92C204E3655BB81,perfumeria_e_higiene_higiene_intima_incontinencia,Compresas para pequeñas pérdidas de orina ' Absodys Control ' mini Carrefour 20 ud.,,2.69,0.13,ud,2021-01-08 12:00:00
433463D95980C252B92C204E3655BB81,perfumeria_e_higiene_cabello_cuidado_y_tratamientos_del_cabello,Tratamiento capilar reparador para puntas abiertas Gliss 50 ml.,50 Ml.,5.45,10.9,100 ml,2020-11-18 00:00:00
885EA3C1F14BDAE3193991E63BF5CFA4,huevos_leche_y_mantequilla_mantequilla_y_margarina,Margarina Hacendado,Tarrina,0.8,1.6,kg,2020-12-21 00:00:00
885EA3C1F14BDAE3193991E63BF5CFA4,maquillaje_ojos,Máscara de pestañas longitud Xtrem Deliplus azul,,3.65,36.5,100 ml,2020-12-16 04:00:00
ADCA3FE6444F01A88B191BBCD4249311,lacteos_y_huevos_yogures_bifidus,DANONE ACTIVIA bífidus con espelta y semillas de amapola pack 4 unidades 120 gr,,2.29,4.77,€/Kg.,2021-01-23 00:00:00
433463D95980C252B92C204E3655BB81,la_despensa_conservas_sopas_y_precocinados_congelados_en_conservas_sopas_y_precocinados,"Relleno para fajitas de pimientos, pollo y cebolla Carrefour 300 g.",300 G.,1.37,4.57,kg,2020-10-09 00:00:00
ADCA3FE6444F01A88B191BBCD4249311,frescos_carne_y_aves_salchichas_chorizo_morcilla,Chorizo pincho (peso aprox. 460 gr),,3.26,7.09,€/Kg.,2020-12-22 00:00:00
433463D95980C252B92C204E3655BB81,perfumeria_e_higiene_cabello_tinte,Tinte Créme Gloss nº 354 Caoba efecto Henna L'Oréal Casting 1 ud.,1 Ud.,6.6,6.6,ud,2020-12-12 12:00:00
ADCA3FE6444F01A88B191BBCD4249311,platos_preparados_pasta_y_arroz_pasta_y_arroz,TA TUNG fideos yakisoba con pollo bandeja 300 gr,,3.5,11.67,€/Kg.,2020-10-14 00:00:00
433463D95980C252B92C204E3655BB81,perfumeria_e_higiene_boca_y_sonrisa_dentifricos,Dentífrico 3D White Luxe Perfección Oral-B 75 ml.,,2.92,3.89,100ml,2021-01-22 12:00:00
ADCA3FE6444F01A88B191BBCD4249311,perfumeria_e_higiene_cuidado_facial_mascarillas,GARNIER Skin active mascarilla facial hidratante revitalizante sachet 1 ud,,2.5,2.5,€/ud.,2020-10-30 00:00:00
ADCA3FE6444F01A88B191BBCD4249311,drogueria_y_limpieza_otros_articulos_bazar_otros_articulos_bazar,Vela cumpleaños Nº 3,,0.59,0.59,€/ud.,2020-09-12 16:00:00
885EA3C1F14BDAE3193991E63BF5CFA4,congelados_pescado,Anguriñas de surimi Pescanova ultracongeladas,Pack-2,3.95,7.6,kg,2020-09-03 16:00:00
433463D95980C252B92C204E3655BB81,la_despensa_dulce_y_desayuno_cacaos_y_cereales_solubles,Chocolate a la taza en polvo Valor sin gluten 1 kg.,,4.95,4.95,kg,2021-01-14 12:00:00
433463D95980C252B92C204E3655BB81,perfumeria_e_higiene_bano_e_higiene_corporal_geles_de_bano,"Gel de ducha leche y miel limpia y suaviza para todo tipo de pieles Carrefour 1,5 l.",1.5 L.,2.2,0.15,100 ml,2020-10-21 00:00:00
433463D95980C252B92C204E3655BB81,perfumeria_e_higiene_cabello_cepillos_peines_y_accesorios,Pinza colores bñásicos Ponette 1 ud.,,1.86,1.86,ud,2020-12-27 12:00:00
433463D95980C252B92C204E3655BB81,el_mercado_panaderia_bolleria_y_pasteleria_masa_fresca_y_bases,Masa de pizza finissima Maxi Buitoni 385 g.,,2.8,8.0,kg,2021-01-26 00:00:00
433463D95980C252B92C204E3655BB81,limpieza_y_hogar_menaje_hermeticos,"Recipiente Hermético Rectangular de Cristal 0,6 L. - Transparente",,4.5,4.5,ud,2021-01-18 12:00:00
ADCA3FE6444F01A88B191BBCD4249311,perfumeria_e_higiene_gel_de_bano_gel_de_bano,NIVEA Men gel de ducha energy bote 500 ml,,3.39,6.78,€/l.,2021-01-09 12:00:00
433463D95980C252B92C204E3655BB81,la_despensa_alimentacion_pastas,Macarrón integral ecológico Carrefour Bio 500 g.,,0.79,1.58,kg,2020-12-20 01:00:00
433463D95980C252B92C204E3655BB81,bebidas_vinos_bio_en_vinos,Vino D.O. Rioja tinto crianza ecológico Vites Virides 75 cl.,75 Cl.,5.55,5.55,ud,2020-07-27 17:36:00
885EA3C1F14BDAE3193991E63BF5CFA4,marisco_y_pescado_pescado_en_bandeja,Filetes de trucha,Bandeja,5.22,13.05,kg,2020-11-07 12:00:00
433463D95980C252B92C204E3655BB81,la_despensa_lacteos_batidos_y_horchatas,Batido de cacao Carrefour sin gluten pack de 6 brik de 200 ml.,,1.77,1.47,l,2021-01-25 12:00:00
433463D95980C252B92C204E3655BB81,la_despensa_aperitivos_torreznos_y_cortezas,Morritos de cerdo 175 g,175 G.,3.0,17.14,kg,2020-10-29 15:00:00
433463D95980C252B92C204E3655BB81,bebidas_alcoholes_todos_los_alcoholes,Vermut Martini blanco 1 l.,,9.49,9.49,l,2021-01-26 00:00:00
433463D95980C252B92C204E3655BB81,el_mercado_charcuteria_y_quesos_al_corte_quesos_barra_y_frescos,Queso fresco de cabra cincho con sal Angulo al corte 150 g aprox,Envase De 150.0 G. Aprox,1.87,12.45,kg,2020-11-10 12:00:00
433463D95980C252B92C204E3655BB81,el_mercado_panaderia_bolleria_y_pasteleria_pan_de_molde_tostado_y_picos,Pan de molde con grano entero 12 cereales Bimbo-Oreweat 680 g.,,2.65,3.9,kg,2020-12-24 12:00:00
ADCA3FE6444F01A88B191BBCD4249311,perfumeria_e_higiene_depilacion_bandas,VEET Easy gelwax bandas de cera depilatoria facial piel normal caja 20 uds,,4.99,0.25,€/ud.,2020-11-01 00:00:00
433463D95980C252B92C204E3655BB81,limpieza_y_hogar_productos_para_cocina_lavavajillas_a_maquina,Gel para lavavajillas todo en uno Carrefour 32 lavados,,2.6,4.06,l,2021-01-12 12:00:00
885EA3C1F14BDAE3193991E63BF5CFA4,cereales_y_galletas_tortitas,Tortitas de arroz con chocolate Hacendado,Paquete,1.55,12.7,kg,2020-12-15 00:00:00
433463D95980C252B92C204E3655BB81,perfumeria_e_higiene_depilacion_y_afeitado_maquinillas_y_recambios,Desechable Sensor 3 Gillette 4 ud.,4 Ud.,6.35,1.59,ud,2020-12-09 00:00:00
433463D95980C252B92C204E3655BB81,la_despensa_conservas_sopas_y_precocinados_conservas_de_pescado_y_marisco,Atún claro al natural Carrefour pack de 6 latas de 56 g.,,3.3,9.82,kg,2021-01-02 12:00:00
ADCA3FE6444F01A88B191BBCD4249311,perfumeria_e_higiene_cosmetica_cosmetica,ESSENCE Mattifiying compact powder polvos matificantes  04 Perfect Beige,,3.59,3.59,€/ud.,2020-09-05 16:00:00
433463D95980C252B92C204E3655BB81,bebidas_aguas_y_zumos_zumos_no_refrigerados,"Zumo de melocotón, manzana y uva Carrefour pack de 6 briks de 20 cl.",,0.87,0.72,l,2021-01-25 00:00:00
433463D95980C252B92C204E3655BB81,el_mercado_verduras_y_hortalizas_bio_en_verduras_y_hortalizas,Calabacín ecológico Carrefour Bio 500 g,500 G,1.59,3.18,kg,2020-12-06 01:00:00
433463D95980C252B92C204E3655BB81,limpieza_y_hogar_menaje_utensilios_de_cocina,Sacacorcho de Inox Cromado FACKELMANN Bar&Wine 1cm - azul,,2.99,2.99,ud,2020-12-31 00:00:00
433463D95980C252B92C204E3655BB81,perfumeria_e_higiene_cosmetica_ojos,Contorno de ojos Gold Cellular Les Cosmetiques 15 ml.,,5.15,34.33,100ml,2021-01-01 12:00:00
433463D95980C252B92C204E3655BB81,parafarmacia_nutricion_y_dietetica_complementos_vitaminicos,Magnesio + Calcio + Isoflavonas de soja sin azúcar Vallesol 24 comprimidos.,24 Comprimidos.,5.4,8.04,100 g,2020-10-31 00:00:00
ADCA3FE6444F01A88B191BBCD4249311,drogueria_y_limpieza_accesorios_limpieza_fregonas,VILEDA fregona supersuave amarilla bolsa 1 ud,,2.19,2.19,€/ud.,2021-01-18 00:00:00
433463D95980C252B92C204E3655BB81,la_despensa_alimentacion_vitaminas_y_complementos,Arándano rojo americano Naturtierra 30 ud.,,5.55,55.5,100g,2020-12-23 12:00:00
433463D95980C252B92C204E3655BB81,perfumeria_e_higiene_cabello_champus,Champú repara y protege para cabello débil o dañado Pantene 700 ml.,,5.85,0.84,100ml,2021-01-03 12:00:00
ADCA3FE6444F01A88B191BBCD4249311,charcuteria_y_quesos_cocido_bacon_y_panceta,DIA bacon en lonchas sobre 200 gr,,1.85,9.25,€/Kg.,2020-08-26 04:00:00
ADCA3FE6444F01A88B191BBCD4249311,congelados_y_helados_helados_tartas_y_otros_postres,RAPUN trenza de Huesca caja 450 gr,,9.65,21.44,€/Kg.,2021-01-26 13:00:00
433463D95980C252B92C204E3655BB81,el_mercado_pescaderia_marisco_almejas_y_mejillones,Mejillón pasteurizado Calidad y Origen Carrefour 800 g,,3.95,4.94,kg,2021-01-27 12:00:00
433463D95980C252B92C204E3655BB81,perfumeria_e_higiene_cabello_champus,CH LECHE ALMEND-VAINILL PPB 1L,,0.99,0.1,100ml,2020-12-17 10:00:00
433463D95980C252B92C204E3655BB81,la_despensa_yogures_y_postres_otros_postres,Cuajada azucarada Carrefour pack de 4 unidades de 125 g.,Pack 4x125 G.,0.95,1.9,kg,2020-11-30 00:00:00
ADCA3FE6444F01A88B191BBCD4249311,charcuteria_y_quesos_charcuteria_y_quesos_al_corte_charcuteria_curada_al_corte,LOPEZ PUERTO jamón ibérico de bellota en tapas cortado a mano sobre (peso aprox. 100 gr),,14.9,149.0,€/Kg.,2020-08-02 04:00:00
ADCA3FE6444F01A88B191BBCD4249311,perfumeria_e_higiene_higiene_bucal_enjuagues_y_antisepticos,COLGATE enjuague bucal minions para niños botella 250 ml,,2.59,10.36,€/l.,2021-01-18 00:00:00
433463D95980C252B92C204E3655BB81,perfumeria_e_higiene_cuidado_y_proteccion_corporal_piel,Crema de noche anti-edad Revitalift Filler L'Oréal 50 ml.,50 Ml.,18.85,37.7,100 ml,2020-10-21 12:00:00
433463D95980C252B92C204E3655BB81,bebe_panales_y_toallitas_toallitas,Toallitas para bebé pure extra care Huggies 168 ud.,,3.9,0.02,ud,2020-12-21 12:00:00
ADCA3FE6444F01A88B191BBCD4249311,desayuno_dulces_y_pan_preparacion_de_postres_decoracion_y_complementos_para_postres,DR. OETKER aromatizante naranjas de valencia botella 35 ml,,3.89,111.14,€/l.,2021-01-20 12:00:00
