supermarket,category,name,description,price,reference_price,reference_unit,insert_date
433463D95980C252B92C204E3655BB81,bebidas_aguas_y_zumos_agua_con_sabor,Agua de coco verde ecológica Isola Bio brik 50 cl.,50 Cl.,3.7,7.4,l,2020-10-14 12:00:00
ADCA3FE6444F01A88B191BBCD4249311,perfumeria_e_higiene_limpieza_facial_leche_y_tonicos_limpiadores,L'OREAL gel purificante arcillas tubo 150 ml,,5.9,39.33,€/l.,2021-01-22 12:00:00
433463D95980C252B92C204E3655BB81,la_despensa_dulce_y_desayuno_cereales_y_barritas,Avena suave Oatibix Weetabix 500 g.,500 G.,1.34,2.68,kg,2020-10-24 00:00:00
433463D95980C252B92C204E3655BB81,perfumeria_e_higiene_cosmetica_labios,Barra de labios Lasting Finish nº 170 Rimmel 1 ud.,,7.1,7.1,ud,2021-01-13 12:00:00
ADCA3FE6444F01A88B191BBCD4249311,alimentacion_patatas_fritas_aperitivos_y_frutos_secos_aperitivos,MATUTANO bocabits bolsa 84GRS,,1.61,19.17,€/Kg.,2020-08-25 16:00:00
433463D95980C252B92C204E3655BB81,el_mercado_charcuteria_tablas_y_surtidos,"Tabla 3 embutidos curados Salamanca: lomo, chorizo y salchichón sin gluten 120 g",120 G,2.65,2.65,ud,2020-11-03 00:00:00
433463D95980C252B92C204E3655BB81,el_mercado_panaderia_bolleria_y_pasteleria_pasteleria_y_reposteria,Tarta brownie Carrefour 1 ud,1 Ud,9.3,9.3,ud,2020-11-01 12:00:00
433463D95980C252B92C204E3655BB81,la_despensa_alimentacion_nutricion_deportiva,Barrita de cacahuete ecológica Taste of Nature 40 g.,40 G.,1.77,44.25,kg,2020-10-23 12:00:00
433463D95980C252B92C204E3655BB81,la_despensa_conservas_sopas_y_precocinados_conservas_de_pescado_y_marisco,Atún claro en aceite de oliva Carrefour 73 g.,73 G.,1.17,16.03,kg,2020-11-30 00:00:00
ADCA3FE6444F01A88B191BBCD4249311,perfumeria_e_higiene_higiene_intima_compresas,EVAX Cottonlike compresa super con alas bolsa 12 uds,,2.79,0.23,€/ud.,2020-12-29 00:00:00
ADCA3FE6444F01A88B191BBCD4249311,alimentacion_salsas_otras_salsas,HEINZ salsa curry con mango bote 220 ml,,1.85,8.41,€/l.,2020-09-23 14:15:00
433463D95980C252B92C204E3655BB81,bebidas_refrescos_sabores_sin_gas,Refresco de manzana Trina zero sin gas lata 33 cl.,33 Cl.,0.55,1.67,l,2020-10-25 13:00:00
ADCA3FE6444F01A88B191BBCD4249311,drogueria_y_limpieza_cuidado_ropa__complementos_quitamanchas,SANYTOL quitamanchas desinfectante bote 450 gr,,4.99,11.09,€/Kg.,2020-11-15 12:00:00
885EA3C1F14BDAE3193991E63BF5CFA4,agua_y_refrescos_refresco_de_naranja_y_de_limon,Refresco de limón Hacendado fresh gas,Lata,0.4,0.8,L,2020-09-13 04:00:00
ADCA3FE6444F01A88B191BBCD4249311,alimentacion_caldos_sopas_y_pures_caldos_y_sopas_en_brick,GALLINA BLANCA caldo de carne 100% natural envase 1 lt,,1.8,1.8,€/l.,2020-09-02 16:00:00
433463D95980C252B92C204E3655BB81,limpieza_y_hogar_bazar_burletes,Cinta Adhesiva Americana Especial Exterior 25m x 50mm Gris,,5.3,5300.0,ud,2020-10-07 12:00:00
885EA3C1F14BDAE3193991E63BF5CFA4,cuidado_del_cabello_acondicionador_y_mascarilla,Mascarilla Be Radiant Deliplus cabello apagado,Tarro,2.75,0.69,100 ml,2021-01-03 12:00:00
ADCA3FE6444F01A88B191BBCD4249311,platos_preparados_tortillas_tortillas,AL PUNTO tortilla de patatas fresca con cebolla envase 600 gr,,1.85,3.08,€/Kg.,2020-12-06 12:00:00
433463D95980C252B92C204E3655BB81,el_mercado_frutas_pinas_kiwis_aguacates_y_tropicales,Piña golden ripe 2 Kg aprox ,Bandeja De  2000.0 G. Aprox,1.58,0.79,kg,2020-12-13 01:00:00
433463D95980C252B92C204E3655BB81,limpieza_y_hogar_cuidado_de_la_ropa_aditivos_y_quitamanchas,Desinfectante Ropa Sanytol 500 ml,,2.73,5.46,l,2020-12-23 00:00:00
433463D95980C252B92C204E3655BB81,limpieza_y_hogar_cuidado_de_la_ropa_detergentes,Detergente líquido cerezas de Japón Carrefour 40 lavados.,40 Lavados.,4.15,0.1,lavado,2020-11-20 12:00:00
ADCA3FE6444F01A88B191BBCD4249311,perfumeria_e_higiene_cosmetica_quitaesmalte_y_accesorios,BETER brocha para polvos 1 ud,,5.99,5.99,€/ud.,2020-10-28 12:00:00
433463D95980C252B92C204E3655BB81,la_despensa_dulce_y_desayuno_galletas,Galletas ecológicas Digestive Santiveri sin gluten y sin lactosa 330 g.,330 G.,4.0,11.11,kg,2020-10-28 12:00:00
433463D95980C252B92C204E3655BB81,la_despensa_conservas_sopas_y_precocinados_conservas_de_pescado_y_marisco,Atún claro en aceite de oliva Isabel sin lactosa pack de 6 latas de 52 g.,,4.85,15.54,kg,2021-01-19 12:00:00
885EA3C1F14BDAE3193991E63BF5CFA4,cuidado_del_cabello_peines_y_accesorios,Coletero para recogido negro Deliplus,,1.6,1.6,ud,2020-11-02 00:00:00
433463D95980C252B92C204E3655BB81,el_mercado_quesos_con_denominacion_origen,Queso de Mahon-Menorca DOP De Nuestra Tierra cuña 300 g,Cuña De 300.0 G. Aprox,6.57,21.9,kg,2020-10-29 13:00:00
885EA3C1F14BDAE3193991E63BF5CFA4,zumos_melocoton_y_pina,Zumo de piña selección Hacendado,Brick,1.59,1.59,L,2020-12-20 12:00:00
433463D95980C252B92C204E3655BB81,perfumeria_e_higiene_bano_e_higiene_corporal_desodorantes,Desodorante stick para hombre Citron Old Spice 50 ml.,50 Ml.,3.7,7.4,100 ml,2020-11-28 12:00:00
433463D95980C252B92C204E3655BB81,el_mercado_quesos_queso_fresco,Queso Burgos línea natural García Baquero pack de 2 unidaes de 225 g.,Pack 2x225 G.,3.55,7.89,kg,2020-10-22 14:00:00
ADCA3FE6444F01A88B191BBCD4249311,bebidas_isotonicas_y_energeticas_energeticas,RED BULL bebida energética maxi lata 35.5 cl,,1.75,4.93,€/l.,2020-07-27 04:00:00
ADCA3FE6444F01A88B191BBCD4249311,drogueria_y_limpieza_lavavajillas_complementos_lavavajillas,FINISH abrillantador máquina para vajilla limón botella 500 ml,,4.99,9.98,€/l.,2020-11-12 00:00:00
ADCA3FE6444F01A88B191BBCD4249311,charcuteria_y_quesos_cocido_fiambres_ave,ELPOZO Bienstar pechuga de pavo en lonchas sobre 85 gr,,1.0,11.76,€/Kg.,2020-11-13 12:00:00
885EA3C1F14BDAE3193991E63BF5CFA4,congelados_pizzas,Pizza estacione rellena de queso Hacendado ultracongelada,,2.99,5.54,kg,2020-09-08 16:00:00
ADCA3FE6444F01A88B191BBCD4249311,perfumeria_e_higiene_higiene_bucal_seda_dental,BONTE seda dental menta y cera caja 50 metros,,1.45,1.45,€/m.,2020-10-04 00:00:00
433463D95980C252B92C204E3655BB81,el_mercado_quesos_todos_los_quesos,Queso edam holland en lonchas Carrefour 200 g.,,1.13,5.65,kg,2021-01-25 00:00:00
433463D95980C252B92C204E3655BB81,la_despensa_conservas_sopas_y_precocinados_conservas_de_pescado_y_marisco,Almejas al natural Carrefour 63 g.,63 G.,2.09,33.17,kg,2020-12-05 00:00:00
885EA3C1F14BDAE3193991E63BF5CFA4,aceite_especias_y_salsas_especias,Sazonador pollo asado Hacendado,Bote,1.5,28.85,kg,2020-12-16 04:00:00
433463D95980C252B92C204E3655BB81,la_despensa_lacteos_batidos_y_horchatas,Batido de chocolate Puleva sin lactosa pack de 6 briks de 200 ml.,Pack 6x200 Ml.,2.1,1.75,l,2020-10-14 12:00:00
433463D95980C252B92C204E3655BB81,limpieza_y_hogar_conservacion_de_alimentos_bolsas,Bolsas multiusos cierre cremallera Carrefour 25 ud.,,1.77,0.07,ud,2020-12-26 12:00:00
433463D95980C252B92C204E3655BB81,bebidas_vinos_blanco,Vino D.O. Rueda blanco verdejo fermentado en barrica José Pariente 75 cl.,75 Cl.,14.25,14.25,ud,2020-12-02 00:00:00
433463D95980C252B92C204E3655BB81,la_despensa_lacteos_leche,Leche semidesnatada Pascual sin lactosa brik 1 l.,,0.99,0.99,l,2020-12-25 00:00:00
433463D95980C252B92C204E3655BB81,el_mercado_carniceria_carne_picada,Carne picada de pollo Carrefour 400 g,Bandeja De 400 G,2.99,,,2020-07-21 04:00:00
ADCA3FE6444F01A88B191BBCD4249311,alimentacion_sal_especias_y_sazonadores_especias,DIA canela molida frasco 38 gr,,0.37,9.74,€/Kg.,2020-11-08 00:00:00
433463D95980C252B92C204E3655BB81,la_despensa_alimentacion_pastas,Fideo entrefino Carrefour 500 g.,,0.55,1.1,kg,2020-12-29 00:00:00
433463D95980C252B92C204E3655BB81,parafarmacia_cuidado_e_higiene_facial_cremas_faciales,Crema hidratante mate Factor de Crecimiento Epitelial Farma Dorsch 50 ml.,,26.6,53.2,100ml,2021-01-01 12:00:00
433463D95980C252B92C204E3655BB81,perfumeria_e_higiene_cabello_cuidado_y_tratamientos_del_cabello,Ampollas superalimento BB7 Pantene 3 unidades de 15ml.,3x15ml.,4.8,10.67,100 ml,2020-11-05 00:00:00
433463D95980C252B92C204E3655BB81,la_despensa_dulce_y_desayuno_mermeladas_membrillos_y_compotas,Mermelada de piña La Vieja Fábrica 350 g.,350 G.,1.97,5.63,kg,2020-12-06 01:00:00
433463D95980C252B92C204E3655BB81,la_despensa_yogures_y_postres_yogures_liquidos,Yogur líquido de fresa sin azúcar añadido Danone Danacol sin gluten pack de 14 unidades de 100 g.,,6.76,4.83,kg,2021-01-09 00:00:00
ADCA3FE6444F01A88B191BBCD4249311,frescos_pescado_y_marisco_marisco_fresco,Anillas de potón (peso aprox. 250 gr),,1.5,5.99,€/Kg.,2020-11-01 00:00:00
433463D95980C252B92C204E3655BB81,la_despensa_dulce_y_desayuno_galletas,Galletas con pepitas de chocolate sin azúcar añadido Diet Nature Gullón 125 g.,,1.48,11.84,kg,2020-12-20 12:00:00
433463D95980C252B92C204E3655BB81,la_despensa_conservas_sopas_y_precocinados_conservas_de_pescado_y_marisco,Sardinillasen aceite vegetal Cenador 650 g.,650 G.,6.65,10.23,kg,2020-11-21 12:00:00
433463D95980C252B92C204E3655BB81,limpieza_y_hogar_calzado_crema,Crema para calzado color Incoloro Kiwi 50 ml.,50 Ml.,1.9,,,2020-07-20 16:00:00
ADCA3FE6444F01A88B191BBCD4249311,desayuno_dulces_y_pan_chocolates_y_bombones_grajeas_y_huevos_chocolate,LACASITOS chocolate tubo pack 4 uds 80 gr,,2.19,27.38,€/Kg.,2020-10-17 00:00:00
885EA3C1F14BDAE3193991E63BF5CFA4,carne_aves_y_pollo,Filetes de pavo contramuslo,Bandeja,3.33,5.95,kg,2020-12-24 00:00:00
433463D95980C252B92C204E3655BB81,la_despensa_dulce_y_desayuno_miel,Miel de eucalipto Carrefour 500 g.,,3.55,7.1,kg,2020-12-29 12:00:00
433463D95980C252B92C204E3655BB81,la_despensa_dulce_y_desayuno_galletas,Galletas Muesli Diet Fibra Gullón 450 g.,500 G.,2.29,5.09,kg,2020-12-11 00:00:00
433463D95980C252B92C204E3655BB81,perfumeria_e_higiene_cosmetica_labios,Barra de labios súper 24 h 510 Maybelline 1 ud.,1 Ud.,8.95,8.95,ud,2020-10-28 12:00:00
433463D95980C252B92C204E3655BB81,bebidas_vinos_vinos_internacionales,Vino tinto Da Luca 75 cl.,75 Cl.,6.85,6.85,ud,2020-11-20 00:00:00
ADCA3FE6444F01A88B191BBCD4249311,perfumeria_e_higiene_cuidado_pies_desodorante,BYRELAX desodorante antitranspirante pies secos y protegidos spray 200 ml,,3.99,19.95,€/l.,2020-12-10 12:00:00
ADCA3FE6444F01A88B191BBCD4249311,bebidas_vinos_tintos_galicia,BERBERANA SELECCIÓN ORO vino tinto de la tierra de Castila botella 75 cl,,2.69,3.59,€/l.,2020-11-25 00:00:00
885EA3C1F14BDAE3193991E63BF5CFA4,limpieza_y_hogar_papel_higienico_y_celulosa,Papel higiénico doble rollo Bosque Verde,Paquete,2.07,0.35,ud,2021-01-17 00:00:00
433463D95980C252B92C204E3655BB81,el_mercado_charcuteria_bio_en_charcuteria,Pechuga de pavo ecológico Carrefour Bio 100 g,100 G,2.75,27.5,kg,2020-11-12 12:00:00
ADCA3FE6444F01A88B191BBCD4249311,lacteos_y_huevos_yogures_bifidus,DANONE ACTIVIA bífidus de fresa pack 4 unidades 120 gr,,2.29,4.77,€/Kg.,2020-11-30 12:00:00
433463D95980C252B92C204E3655BB81,la_despensa_alimentacion_arroz_y_cous_cous,Cuscús grano mediano Gallo 500 g.,500 G.,1.42,2.84,kg,2020-11-11 00:00:00
433463D95980C252B92C204E3655BB81,limpieza_y_hogar_ambientadores_automaticos,Ambientador automático Fresh Matic Lirio de Luna recambio Air Wick 2 ud.,2 Recambios.,7.55,3.78,ud,2020-10-16 13:00:00
433463D95980C252B92C204E3655BB81,perfumeria_e_higiene_bano_e_higiene_corporal_colonias,Agua de colonia nº 16 Amaderada oriental para hombre Caravan 150 ml.,150 Ml.,10.08,6.72,100 ml,2020-10-17 00:00:00
433463D95980C252B92C204E3655BB81,perfumeria_e_higiene_bano_e_higiene_corporal_desodorantes,Desodorante roll-on dermo invisible 24h antitranspirante piel sana Sanex pack de 2 unidades de 50 ml.,,3.35,3.35,100ml,2020-12-19 00:00:00
ADCA3FE6444F01A88B191BBCD4249311,drogueria_y_limpieza_limpiadores_para_el_hogar_fregasuelos,MENFORSAN limpia suelos higienizante botella 1 lt,,5.15,5.15,€/ud.,2020-10-19 12:00:00
885EA3C1F14BDAE3193991E63BF5CFA4,limpieza_y_hogar_limpieza_muebles_y_multiusos,Limpiador muebles y parquet Bosque Verde,Botella,1.95,2.6,L,2021-01-20 12:00:00
433463D95980C252B92C204E3655BB81,el_mercado_carniceria_aves_y_pollo,Media gallina Nutrave 600 g aprox,Bandeja De  600.0 G. Aprox,2.01,3.35,kg,2020-11-16 12:00:00
433463D95980C252B92C204E3655BB81,la_despensa_alimentacion_semillas,Quinoa blanca ecológica Carrefour Bio 400 g.,400 G.,2.15,5.37,kg,2020-11-26 12:00:00
ADCA3FE6444F01A88B191BBCD4249311,drogueria_y_limpieza_accesorios_limpieza_bayetas_y_gamuzas,LIMPIAMAS paño especial cristales paquete 1 ud,,4.59,4.59,€/ud.,2020-08-03 04:00:00
ADCA3FE6444F01A88B191BBCD4249311,perfumeria_e_higiene_cuidado_del_cabello_accesorios_cabello,YATP cepillo desenredante 1 ud,,7.05,7.05,€/ud.,2020-10-04 00:00:00
ADCA3FE6444F01A88B191BBCD4249311,congelados_y_helados_verdura_y_fruta_judias_verdes_habas_y_guisantes,FINDUS guisantes superfinos bolsa 400 gr,,2.29,5.73,€/Kg.,2021-01-02 00:00:00
433463D95980C252B92C204E3655BB81,el_mercado_verduras_y_hortalizas_patatas_cebollas_y_ajos,Patata trumferoles Potatum 3 Kg,,3.99,1.33,kg,2021-01-19 12:00:00
433463D95980C252B92C204E3655BB81,la_despensa_lacteos_bebida_vegetal,Bebida de soja con calcio Carrefour sin gluten brik 1 l.,,0.59,0.59,l,2021-01-02 00:00:00
ADCA3FE6444F01A88B191BBCD4249311,perfumeria_e_higiene_limpieza_facial_leche_y_tonicos_limpiadores,BONTE tónico facial para pieles sensibles botella 250 ml,,1.65,6.6,€/l.,2020-07-26 16:00:00
433463D95980C252B92C204E3655BB81,limpieza_y_hogar_productos_para_cocina_lavavajillas_a_maquina,Lavavajillas máquina original Todo en 1 en cápsulas Fairy 55 ud.,55 Ud.,14.7,14.7,100 ml,2020-09-26 12:04:00
ADCA3FE6444F01A88B191BBCD4249311,drogueria_y_limpieza_ambientadores_continuos_y_decorativos,LACROSSE ambientador mikado orchid 50 ml,,7.99,159.8,€/l.,2020-09-19 04:00:00
433463D95980C252B92C204E3655BB81,perfumeria_e_higiene_cabello_champus,Champú fortificante Fuerza y Brillo para cabello normal Garnier-Fructis 360 ml.,,3.59,1.0,100ml,2021-01-02 00:00:00
433463D95980C252B92C204E3655BB81,perfumeria_e_higiene_higiene_intima_tampones,TAMPON OB SIN APLIC SUPERP 16U,,3.4,0.21,ud,2020-12-25 12:00:00
433463D95980C252B92C204E3655BB81,limpieza_y_hogar_papeleria_marcadores,15 Marcadores Boss Originales Stabilo,15 Ud.,13.85,0.92,ud,2020-09-26 12:04:00
885EA3C1F14BDAE3193991E63BF5CFA4,cuidado_facial_y_corporal_desodorante,Desodorante hombre dark temptation Axe,Spray,3.6,2.4,100 ml,2020-08-03 16:00:00
433463D95980C252B92C204E3655BB81,la_despensa_dulce_y_desayuno_cafes,"Café Doble Descafeinado en cápsulas XXL L'Or Barista 10 unidades de 10,4 g.",10 Ud.,5.3,50.96,kg,2020-10-20 00:00:00
433463D95980C252B92C204E3655BB81,el_mercado_quesos_otros_internacionales,Queso edam holland en lonchas Carrefour 200 g.,200 G,0.97,4.85,kg,2020-11-18 00:00:00
433463D95980C252B92C204E3655BB81,el_mercado_quesos_rallados,Queso rallado 4 quesos Albeniz 150 g.,150 G.,2.49,16.6,kg,2020-11-09 00:00:00
433463D95980C252B92C204E3655BB81,la_despensa_cestas_y_lotes_cestas_de_navidad,Lote de Navidad nº 6,1 Ud.,42.0,42.0,ud,2020-12-13 12:00:00
433463D95980C252B92C204E3655BB81,la_despensa_dulce_y_desayuno_infusiones_y_tes,Te Verde Marrakech con hierbabuena Hornimans 85 g,85 G.,2.85,33.53,kg,2020-10-26 12:00:00
433463D95980C252B92C204E3655BB81,la_despensa_dulce_y_desayuno_chocolates_turrones_y_bombones,Panettone con pepitas de chocolate Carrefour 500 g.,500 G.,2.95,5.9,kg,2020-11-04 13:00:00
ADCA3FE6444F01A88B191BBCD4249311,perfumeria_e_higiene_cuidado_facial_cremas_especificas,BELCILS crema regeneradora intensiva de pestañas 4 ml,,16.45,4112.5,€/l.,2020-11-21 12:00:00
433463D95980C252B92C204E3655BB81,parafarmacia_cuidado_de_manos_y_pies_crema_de_manos,Crema de manos concentrada Neutrogena pack de 2 unidades de 50 ml.,Pack 2x50 Ml.,10.55,10.55,100 ml,2020-11-17 00:00:00
433463D95980C252B92C204E3655BB81,perfumeria_e_higiene_cuidado_y_proteccion_corporal_limpieza_facial,Discos de algodón desmaquillantes Carrefour 35 ud.,,0.54,0.02,ud,2020-12-28 00:00:00
ADCA3FE6444F01A88B191BBCD4249311,alimentacion_patatas_fritas_aperitivos_y_frutos_secos_frutos_secos,FRIT RAVICH dátiles bandeja 500 gr,,2.49,4.98,€/Kg.,2020-12-25 00:00:00
433463D95980C252B92C204E3655BB81,limpieza_y_hogar_papel_y_celulosa_servilletas,Servilleta dos Capas CARREFOUR 22x20 cm 500 ud - Blanco,500 Ud,2.99,2.99,ud,2020-10-15 00:00:00
433463D95980C252B92C204E3655BB81,mascotas_pajaros_pienso_para_pajaros,Carrefour Comida para Tórtolas 1Kg,1 Kg,2.5,2.5,kg,2020-10-04 00:00:00
433463D95980C252B92C204E3655BB81,el_mercado_quesos_tierno,Queso de cabra tierno El Ventero 550 g,,8.45,15.36,kg,2021-01-06 12:00:00
885EA3C1F14BDAE3193991E63BF5CFA4,maquillaje_ojos,Sombra de ojos Seco & mojado dúo Deliplus 07,,2.5,2.5,ud,2020-09-17 16:00:00
433463D95980C252B92C204E3655BB81,la_despensa_aperitivos_frutos_secos,Cocktail de nueces Borges 100 g.,100 G.,2.9,29.0,kg,2020-10-22 00:00:00
ADCA3FE6444F01A88B191BBCD4249311,mascotas_accesorios_accesorios,MENFORSAN líquido anti orines para perros y gatos pistola 500 ml,,5.99,5.99,€/ud.,2021-01-21 00:00:00
433463D95980C252B92C204E3655BB81,limpieza_y_hogar_utensilios_de_limpieza_bolsas_de_basura,15 Bolsas de basura Reciclaje envases Handy Bag 30 Litros - Amarillas,1 Ud,2.8,0.19,ud,2020-12-04 00:00:00
885EA3C1F14BDAE3193991E63BF5CFA4,agua_y_refrescos_tonica_y_bitter,Tónica Nordic Mist,Lata,0.45,1.8,L,2021-01-01 12:00:00
ADCA3FE6444F01A88B191BBCD4249311,bebidas_alcoholes_y_licores_ginebra,BOMBAY Ginebra bramble botella 70 cl,,18.95,27.07,€/l.,2020-12-22 13:00:00
ADCA3FE6444F01A88B191BBCD4249311,perfumeria_e_higiene_cuidado_manos_crema_de_manos,INSTITUTO ESPAÑOL crema de manos tubo 75 ml,,1.89,25.2,€/l.,2020-12-05 00:00:00
433463D95980C252B92C204E3655BB81,perfumeria_e_higiene_bano_e_higiene_corporal_colonias,Agua de colonia collezione Titto Bluni 100 ml.,100 Ml.,14.3,14.3,100 ml,2020-10-17 12:00:00
433463D95980C252B92C204E3655BB81,perfumeria_e_higiene_bienestar_sexual_lubricantes,Gel de masaje hidratante Exotic Escape Control 200 ml.,,10.1,5.05,100ml,2020-12-22 13:00:00
433463D95980C252B92C204E3655BB81,bebidas_aguas_y_zumos_zumos_no_refrigerados,Zumo de zanahoria y aloe ecológico Delizum botella 1 l.,1 L.,2.65,2.65,l,2020-10-26 00:00:00
433463D95980C252B92C204E3655BB81,bebidas_vinos_todos_los_vinos,Vino tinto de mesa Carrefour brik 1 l.,,0.8,0.8,l,2021-01-10 00:00:00
433463D95980C252B92C204E3655BB81,mascotas_perros_champus,Desodorante suavizante Champú 2en1 para perros Dixie 750 Ml,750 Ml,5.42,,,2020-07-18 04:00:00
433463D95980C252B92C204E3655BB81,la_despensa_dulce_y_desayuno_cafes,"Café sontuoso en cápsulas L'Or Espresso compatible con Nespresso 20 unidades de 5,2 g.",,6.35,61.06,kg,2020-12-28 12:00:00
885EA3C1F14BDAE3193991E63BF5CFA4,cereales_y_galletas_galletas,Galletas Cookies Hacendado,Paquete,0.85,3.78,kg,2020-09-05 04:00:00
433463D95980C252B92C204E3655BB81,parafarmacia_botiquin_antimosquitos,Crema calmante contra la picadura de insectos para niños After Bite 20 g.,,7.5,,,2020-07-16 16:00:00
433463D95980C252B92C204E3655BB81,bebidas_licores_y_cremas_anis_y_chinchon,Anís La Castellana dulce 70 cl.,,7.65,10.93,l,2021-01-10 12:00:00
433463D95980C252B92C204E3655BB81,limpieza_y_hogar_papeleria_pequeno_accesorio,Cola Universal Pritt  100gr,1 Ud.,4.99,4.99,ud,2020-11-05 00:00:00
433463D95980C252B92C204E3655BB81,perfumeria_e_higiene_cabello_cuidado_y_tratamientos_del_cabello,Mascarilla capilar intensiva Suave & Liso para cabello normal-grueso Pantene 300 ml.,300 Ml.,4.25,1.42,100 ml,2020-10-01 12:00:00
433463D95980C252B92C204E3655BB81,la_despensa_aperitivos_aceitunas_y_encurtidos,Aceitunas verdes partidas aliñadas Acoal 280 g,280 G.,2.5,10.0,kg,2020-12-15 00:00:00
885EA3C1F14BDAE3193991E63BF5CFA4,cacao_cafe_e_infusiones_cafe_soluble_y_otras_bebidas,Café con leche descafeinado Hacendado,Vaso,0.75,3.0,L,2020-09-16 16:00:00
433463D95980C252B92C204E3655BB81,parafarmacia_higiene_bucal_frescor_y_aliento,Irrigador oral WP450 Waterpik 1 ud.,1 Ud.,95.4,95.4,ud,2020-10-08 17:00:00
433463D95980C252B92C204E3655BB81,limpieza_y_hogar_utensilios_de_limpieza_guantes,Guante Desechable Vinilo SPONTEX Protect Talla 8 100 ud,100 Ud.,11.95,11.95,ud,2020-11-06 12:00:00
885EA3C1F14BDAE3193991E63BF5CFA4,agua_y_refrescos_refresco_de_te_y_sin_gas,Refresco sandía Gold Spring cero sin gas,Botella,0.95,0.48,L,2020-12-11 12:00:00
885EA3C1F14BDAE3193991E63BF5CFA4,panaderia_y_pasteleria_harina_y_preparado_reposteria,Gasificante repostería casera Hacendado,Caja,0.49,1.11,100 g,2020-12-30 12:00:00
433463D95980C252B92C204E3655BB81,la_despensa_aperitivos_frutos_secos,Nuez mondada Carrefour tarrina 150 g,,3.25,21.67,kg,2020-12-23 12:00:00
433463D95980C252B92C204E3655BB81,el_mercado_panaderia_bolleria_y_pasteleria_masa_fresca_y_bases,Masa Pizza Carrefour 260 g.,260 G.,1.14,4.38,kg,2020-11-26 00:00:00
433463D95980C252B92C204E3655BB81,perfumeria_e_higiene_cosmetica_rostro,Base líquida Lasting Performance 102 Pastelle Max Factor 1 ud.,1 Ud.,13.95,13.95,ud,2020-12-11 12:00:00
433463D95980C252B92C204E3655BB81,el_mercado_quesos_tierno,Mini enrrollados de queso Babybel pack de 5 unidades de 17 g.,,2.15,25.29,kg,2021-01-11 12:00:00
433463D95980C252B92C204E3655BB81,limpieza_y_hogar_menaje_hermeticos,"Hermético Redondo de Cristal BORGONOVO Igloo 2,5 L. - Transparente",,5.99,5.99,ud,2021-01-24 00:00:00
885EA3C1F14BDAE3193991E63BF5CFA4,cuidado_facial_y_corporal_afeitado_y_cuidado_para_hombre,Espuma de afeitar piel sensible Deliplus leche de avena y vitamina E,Bote,0.99,0.33,100 ml,2020-08-05 04:00:00
885EA3C1F14BDAE3193991E63BF5CFA4,charcuteria_y_quesos_jamon_serrano,Taquitos de jamón Incarlopsa,Pack-2,2.19,10.95,kg,2020-09-21 04:00:00
433463D95980C252B92C204E3655BB81,perfumeria_e_higiene_bano_e_higiene_corporal_desodorantes,Desodorante roll- on beauty elixir deomilk fresh Nivea 40 ml.,40 Ml.,2.4,6.0,100 ml,2020-10-25 00:00:00
433463D95980C252B92C204E3655BB81,perfumeria_e_higiene_cosmetica_ojos,Máscara de pestañas Miss Manga mega volumen black L'Oréal 1 ud.,,8.65,8.65,ud,2021-01-27 12:00:00
885EA3C1F14BDAE3193991E63BF5CFA4,congelados_verdura,Patatas Dippers ultracongeladas,Paquete,1.49,2.98,kg,2020-11-24 12:00:00
ADCA3FE6444F01A88B191BBCD4249311,charcuteria_y_quesos_curado_chorizo,ELPOZO chorizo extra sobre 85 gr,,1.0,13.33,€/Kg.,2020-08-18 16:00:00
ADCA3FE6444F01A88B191BBCD4249311,perfumeria_e_higiene_cuidado_del_cabello_mascarillas_cabello,ELVIVE mascarilla rapid reviver aceite extraordinario tubo 300 ml,,3.75,12.5,€/l.,2021-01-26 12:00:00
885EA3C1F14BDAE3193991E63BF5CFA4,aceite_especias_y_salsas_aceite_vinagre_y_sal,Sal 60% menos de sodio Hacendado,Bote,1.2,4.8,kg,2020-11-06 00:00:00
433463D95980C252B92C204E3655BB81,limpieza_y_hogar_productos_para_bano_wc,Colgador WC Fresh Ocean Carrefour 2 ud.,2 Ud.,1.79,0.9,ud,2020-12-07 00:00:00
433463D95980C252B92C204E3655BB81,la_despensa_dulce_y_desayuno_siropes_aromas_y_decoracion,Azúcar avainillado ecológico Vahiné 35 g.,35 G.,4.5,128.57,kg,2020-11-05 00:00:00
885EA3C1F14BDAE3193991E63BF5CFA4,fitoterapia_y_parafarmacia_fitoterapia,Cápsulas t-sacia Deliplus,Caja,3.95,17.95,100 g,2020-11-12 00:00:00
433463D95980C252B92C204E3655BB81,perfumeria_e_higiene_cuidado_y_proteccion_corporal_piel,Crema hidratante revitalizadora de dia Pond's 50 ml.,50 Ml.,6.35,12.7,100 ml,2020-11-13 12:00:00
885EA3C1F14BDAE3193991E63BF5CFA4,azucar_caramelos_y_chocolate_azucar_y_edulcorante,Azúcar moreno de caña Acor,Caja,1.78,1.78,kg,2020-09-27 00:05:00
ADCA3FE6444F01A88B191BBCD4249311,perfumeria_e_higiene_cuidado_del_cabello_tintes_y_coloracion,LLONGUERAS tinte Marrón Chocolate Nº 5.25 caja 1 ud,,5.99,5.99,€/ud.,2020-11-18 00:00:00
ADCA3FE6444F01A88B191BBCD4249311,perfumeria_e_higiene_desodorante_roll_on,BONTE desodorante stress care roll on 50 ml,,0.79,15.8,€/l.,2020-12-28 12:00:00
433463D95980C252B92C204E3655BB81,la_despensa_helados_barquillos,Tulipas Carrefour 75 g.,75 G.,1.31,16.38,kg,2020-09-27 00:05:00
885EA3C1F14BDAE3193991E63BF5CFA4,agua_y_refrescos_refresco_de_cola,Refresco cola Hacendado,Lata,0.35,0.7,L,2020-09-29 00:00:00
ADCA3FE6444F01A88B191BBCD4249311,perfumeria_e_higiene_gel_de_bano_gel_de_bano,DOVE gel de ducha cuidado y protección bote 600 ml,,3.49,5.82,€/l.,2020-11-15 12:00:00
ADCA3FE6444F01A88B191BBCD4249311,congelados_y_helados_pescado_y_marisco_marisco,DIA langostino crudo mediano 48/64 caja 800 gr,,6.45,8.06,€/Kg.,2020-09-13 04:00:00
885EA3C1F14BDAE3193991E63BF5CFA4,fruta_y_verdura_verdura,Sopa juliana para micro,Paquete,1.15,2.88,kg,2020-12-03 00:00:00
ADCA3FE6444F01A88B191BBCD4249311,perfumeria_e_higiene_cuidado_pies_crema,SCHOLL Gel activ almohadilla talón party feet blíster 1 par,,7.99,7.99,€/ud.,2020-11-19 00:00:00
ADCA3FE6444F01A88B191BBCD4249311,perfumeria_e_higiene_higiene_intima_compresas,EVAX Cottonlike compresa normal con alas bolsa 16 uds,,2.59,0.16,€/ud.,2020-10-21 12:00:00
433463D95980C252B92C204E3655BB81,la_despensa_alimentacion_aceites_y_vinagres,Aceite de oliva intenso 1º Carrefour garrafa 5 l.,,10.45,2.09,l,2021-01-06 12:00:00
433463D95980C252B92C204E3655BB81,la_despensa_yogures_y_postres_proteina,Yogur líquido desnatado sabor cookies y vainilla alto en proteínas Danone sin lactosa YoPRO 300 g.,300 G.,1.93,6.43,kg,2020-12-14 00:00:00
ADCA3FE6444F01A88B191BBCD4249311,perfumeria_e_higiene_cuidado_corporal_cremas_cuerpo__body_milk,DOVE loción piel dorada con agentes autobronceadores bote 200 ml,,4.55,18.2,€/l.,2020-12-09 12:00:00
433463D95980C252B92C204E3655BB81,el_mercado_quesos_curado,Queso en lonchas Proteína Plus Carrefour 150 g.,150 G.,1.66,11.07,kg,2020-12-14 00:00:00
433463D95980C252B92C204E3655BB81,limpieza_y_hogar_calzado_crema,Crema autobrillante c/aplicador burdeos Carrefour 50 ml.,50 Ml.,1.82,3.64,100 ml,2020-10-09 00:00:00
433463D95980C252B92C204E3655BB81,la_despensa_lacteos_bio_en_lacteos,Bebida de arroz con almendras ecológica Isola Bio sin gluten brik 250 ml.,250 Ml.,1.12,4.48,l,2020-10-26 00:00:00
885EA3C1F14BDAE3193991E63BF5CFA4,marisco_y_pescado_pescado_fresco,Tiras de potón descongeladas,Granel,589.05,5.95,kg,2020-12-23 00:00:00
433463D95980C252B92C204E3655BB81,la_despensa_alimentacion_especias_y_sazonadores,Cúrcuma Carmencita 45 g.,45 G.,1.54,34.22,kg,2020-11-24 19:00:00
