supermarket,category,name,description,price,reference_price,reference_unit,insert_date
433463D95980C252B92C204E3655BB81,el_mercado_verduras_y_hortalizas_ensaladas_y_verduras_preparadas,Ñora entera deshidratada Trevijano bandeja 60 g,60 G,2.25,37.5,kg,2020-11-26 00:00:00
433463D95980C252B92C204E3655BB81,bebidas_vinos_vinos_internacionales,Vino francés tinto J.P. Chenet 75 cl.,75 Cl.,3.55,3.55,ud,2020-11-11 12:00:00
433463D95980C252B92C204E3655BB81,bebidas_vinos_todos_los_vinos,Vino tinto Chateau Cazeau A.O.C Bordeaux 75 cl.,75 Cl.,3.85,3.85,ud,2020-12-05 00:00:00
433463D95980C252B92C204E3655BB81,la_despensa_dulce_y_desayuno_galletas,Barquillos Carrefour 100 g.,100 G.,0.89,8.9,kg,2020-10-23 00:00:00
433463D95980C252B92C204E3655BB81,bebidas_vinos_blanco,Vino D.O. Rueda blanco verdejo Four Lines 75 cl.,75 Cl.,5.5,5.5,ud,2020-10-26 13:00:00
885EA3C1F14BDAE3193991E63BF5CFA4,aceite_especias_y_salsas_otras_salsas,Carne de pimiento choricero El Sol,Tarro,1.3,9.29,kg,2020-12-19 00:00:00
433463D95980C252B92C204E3655BB81,bebidas_alcoholes_brandy_y_conac,Brandy de Jerez De Nuestra Tierra solera Gran Reserva 70 cl.,70 Cl.,19.75,28.21,l,2020-10-31 12:00:00
ADCA3FE6444F01A88B191BBCD4249311,bebidas_vinos_blancos_valencia,RUEDA CUNE vino blanco verdejo botella 75 cl,,5.2,6.93,€/l.,2020-08-30 04:00:00
885EA3C1F14BDAE3193991E63BF5CFA4,bodega_licores,Licor sin alcohol mora Pi.omka,Botella,1.7,2.43,L,2020-08-07 04:00:00
433463D95980C252B92C204E3655BB81,perfumeria_e_higiene_cabello_acondicionadores,Acondicionador reparador con aminoácidos y ceramida para pelo dañado Total Repair 5 L'Oréal-Elvive 300 ml.,300 Ml.,4.0,1.33,100 ml,2020-12-06 01:00:00
885EA3C1F14BDAE3193991E63BF5CFA4,huevos_leche_y_mantequilla_leche_y_bebidas_vegetales,Preparado lácteo con cereales crecimiento Hacendado +1 año,Pack-6,6.6,1.1,L,2021-01-07 08:00:00
433463D95980C252B92C204E3655BB81,limpieza_y_hogar_menaje_utensilios_de_cocina,Fuente Rectangular Vidrio Borisilicato VITRINOR 35 cm - Granate,1 Ud.,19.9,19.9,ud,2020-11-28 12:00:00
433463D95980C252B92C204E3655BB81,parafarmacia_botiquin_apositos_y_gasas,Apósitos de sutura Carrefour 16 ud.,16 Ud.,2.09,0.13,ud,2020-10-15 16:00:00
ADCA3FE6444F01A88B191BBCD4249311,perfumeria_e_higiene_colonias_femeninas,VICTORIO & LUCCHINO agua de colonia nº 2 spray 150 ml,,11.5,76.67,€/l.,2020-11-16 12:00:00
433463D95980C252B92C204E3655BB81,limpieza_y_hogar_menaje_sartenes_paelleras_y_wok_fondue_parrillas_grill_accesorios,Set de 3 sartenes Aluminio CARREFOUR HOME 20-24-28 cm - Gris,1 Ud.,29.0,29.0,ud,2020-11-26 00:00:00
433463D95980C252B92C204E3655BB81,limpieza_y_hogar_ambientadores_automaticos,Ambientador automático Floral recambio Carrefour 1 ud.,,1.8,7.2,l,2020-12-22 13:00:00
433463D95980C252B92C204E3655BB81,bebidas_refrescos_sabores_sin_gas,"Aquarius sabor naranja botella 1,5 l.",,1.72,1.15,l,2021-01-23 12:00:00
433463D95980C252B92C204E3655BB81,la_despensa_conservas_sopas_y_precocinados_croquetas_y_rebozados,Nuggets kebab Fripozo 300 g.,300 G.,3.0,10.0,kg,2020-10-30 12:00:00
433463D95980C252B92C204E3655BB81,perfumeria_e_higiene_cabello_fijadores,Laca Fijadora normal L'Oréal Elnett 400 ml.,,6.9,1.72,100ml,2021-01-26 00:00:00
885EA3C1F14BDAE3193991E63BF5CFA4,carne_arreglos,Patas de cerdo,Bandeja,2.0,4.0,kg,2020-11-02 12:00:00
ADCA3FE6444F01A88B191BBCD4249311,perfumeria_e_higiene_higiene_intima_incontinencia,AUSONIA Discreet compresas de incontinencia normal paquete 12 uds,,5.49,0.46,€/ud.,2021-01-01 00:00:00
433463D95980C252B92C204E3655BB81,bebidas_vinos_blanco,Vino D.O. Rioja Blanco Selección viñedos El Coto 75 cl.,75 Cl.,4.65,4.65,ud,2020-11-23 00:00:00
ADCA3FE6444F01A88B191BBCD4249311,perfumeria_e_higiene_cuidado_corporal_protector_solar,BONTE leche protectora solar spf 50 formato viaje bote 75 ml,,2.99,39.87,€/l.,2020-09-15 04:00:00
433463D95980C252B92C204E3655BB81,la_despensa_dulce_y_desayuno_cafes,"Café cappuccino en cápsulas L'Or Espresso Tassimo 8 unidades de 33,4 g.",8 Ud.,5.15,19.29,kg,2020-10-25 00:00:00
433463D95980C252B92C204E3655BB81,la_despensa_helados_sandwiches,"Sandwich choco cookie con helado de chocolate Carrefour Extra sin aceite de palma 4 ud,",4 Ud.,2.1,0.52,ud,2020-10-05 12:01:00
433463D95980C252B92C204E3655BB81,la_despensa_dulce_y_desayuno_miel,Miel de flores Granja San Franciso 345 g.,,4.75,13.77,kg,2021-01-16 00:00:00
433463D95980C252B92C204E3655BB81,bebidas_cerveza_rubia,"Cerveza San Miguel 0,0 sin alcohol Lager pack de 12 latas de 33 cl.",,6.48,1.64,l,2020-12-22 13:00:00
ADCA3FE6444F01A88B191BBCD4249311,charcuteria_y_quesos_cocido_jamon_cocido__york,DIA cabeza de jabalí sobre 200 gr,,1.65,8.25,€/Kg.,2020-09-17 16:00:00
885EA3C1F14BDAE3193991E63BF5CFA4,huevos_leche_y_mantequilla_leche_y_bebidas_vegetales,Leche desnatada Hacendado,Brick,0.57,0.57,L,2020-10-30 12:00:00
433463D95980C252B92C204E3655BB81,perfumeria_e_higiene_bano_e_higiene_corporal_colonias,Agua de colonia familiar Puig 750 ml.,,3.55,0.47,100ml,2020-12-26 00:00:00
433463D95980C252B92C204E3655BB81,parafarmacia_higiene_bucal_cepillos_y_seda,Seda dental con flúor y triclosán Lacer 50 metros,50 Metros,3.75,3.75,ud,2020-11-09 00:00:00
433463D95980C252B92C204E3655BB81,la_despensa_aperitivos_frutos_secos,Almendras crudas Carrefour 200 g.,,3.3,16.5,kg,2021-01-08 00:00:00
885EA3C1F14BDAE3193991E63BF5CFA4,cuidado_facial_y_corporal_higiene_intima,Protector cama tamaño 60 x 90 cm Deliplus,Paquete,8.5,0.43,ud,2020-08-16 16:00:00
433463D95980C252B92C204E3655BB81,bebidas_refrescos_te,Refresco de té verde Arizona zero botella 50 cl.,50 Cl.,1.01,2.02,l,2020-07-26 04:00:00
ADCA3FE6444F01A88B191BBCD4249311,drogueria_y_limpieza_cuidado_ropa__complementos_aditivos_para_el_lavado,IBERIA tinte color azul vaquero no destiñe a 40 º C caja 1 ud,,2.45,2.45,€/ud.,2020-09-29 00:00:00
885EA3C1F14BDAE3193991E63BF5CFA4,zumos_fruta_variada,"Bebida de zumo de naranja, mango y zanahoria La Verja sin azúcares añadidos",Botella,1.0,0.67,L,2020-07-31 16:00:00
885EA3C1F14BDAE3193991E63BF5CFA4,agua_y_refrescos_refresco_de_te_y_sin_gas,Refresco té sabor melocotón Hacendado cero,Lata,0.27,0.82,L,2021-01-07 01:00:00
433463D95980C252B92C204E3655BB81,limpieza_y_hogar_papeleria_dibujo_tecnico,Compás colores 3 piezas,3 Ud.,2.5,2.5,ud,2020-11-19 12:00:00
433463D95980C252B92C204E3655BB81,bebidas_alcoholes_vermouth,Petroni,,13.95,13.95,l,2021-01-12 00:00:00
433463D95980C252B92C204E3655BB81,la_despensa_alimentacion_salsas_y_tomate_frito,Salsa argelina Carrefour envase 355 g.,355 G.,1.34,3.77,kg,2020-11-22 00:00:00
433463D95980C252B92C204E3655BB81,la_despensa_dulce_y_desayuno_chocolates_turrones_y_bombones,Cacahuete cubierto de chocolate Conguitos sin gluten 350 g.,350 G.,3.5,10.0,kg,2020-10-17 00:00:00
433463D95980C252B92C204E3655BB81,mascotas_gatos_pienso_para_gatos,"Purina Gourmet Mon Petit Comida Húmeda para Gato Atún, Salmón y Trucha 6x50g",,2.4,8.0,kg,2020-12-31 12:00:00
433463D95980C252B92C204E3655BB81,bebidas_refrescos_sabores_sin_gas,"Refresco de limón Trina zero sin gas botella 1,5 l.","1,5 L.",1.38,0.92,l,2020-10-24 00:00:00
433463D95980C252B92C204E3655BB81,perfumeria_e_higiene_cuidado_y_proteccion_corporal_body_milk_hidratacion_bajo_la_ducha,Crema corporal protectora forte para piel seca Eudermin 400 ml.,400 Ml.,4.15,1.04,100 ml,2020-12-12 12:00:00
ADCA3FE6444F01A88B191BBCD4249311,lacteos_y_huevos_nata_para_montar,ASTURIANA nata para  montar envase 1lt,,3.57,3.57,€/l.,2021-01-12 09:00:00
433463D95980C252B92C204E3655BB81,bebidas_vinos_blanco,Vino blanco Viña Espolon Albariño D.O. Rias Baixas 75 cl.,75 Cl.,7.0,7.0,ud,2020-12-05 00:00:00
ADCA3FE6444F01A88B191BBCD4249311,alimentacion_pastas_espaguetis_y_tallarines,GALLO espaguetis nº 3 paquete 500 gr,,0.99,1.98,€/Kg.,2020-09-14 16:00:00
433463D95980C252B92C204E3655BB81,perfumeria_e_higiene_cabello_fijadores,Laca para rizos definidos Pro-V Pantene 300 ml.,300 Ml.,3.7,1.23,100 ml,2020-11-11 00:00:00
885EA3C1F14BDAE3193991E63BF5CFA4,limpieza_y_hogar_papel_higienico_y_celulosa,Servilleta papel Bosque Verde,Paquete,0.9,0.01,ud,2021-01-07 08:00:00
433463D95980C252B92C204E3655BB81,la_despensa_aperitivos_patatas_fritas,Patatas fritas light Frit Ravich si lactosa 130 g.,,1.4,11.2,kg,2021-01-14 12:00:00
433463D95980C252B92C204E3655BB81,mascotas_peces_y_tortugas_tortugas,Tetra Reptomin Comida para Tortugas Acuáticas 1L/220g,1 Ud,22.45,102.05,kg,2020-12-10 12:00:00
433463D95980C252B92C204E3655BB81,bebe_alimentacion_infantil_papillas_y_galletas,Galletas infantiles desde 8-10 meses con miel ecológicas ecológicas Nestlé Naturnes sin gluten 150 g.,150 G.,3.1,20.67,kg,2020-11-26 00:00:00
433463D95980C252B92C204E3655BB81,la_despensa_conservas_sopas_y_precocinados_conservas_de_vegetales,Mazorquitas maiz frasco cristal Amalur 190 g.,190 G.,2.75,14.47,kg,2020-12-03 00:00:00
885EA3C1F14BDAE3193991E63BF5CFA4,panaderia_y_pasteleria_picos_rosquilletas_y_picatostes,Piquitos bajos en sal Hacendado,Paquete,1.1,4.4,kg,2020-11-20 12:00:00
433463D95980C252B92C204E3655BB81,la_despensa_yogures_y_postres_vegetal,Preparado de almendra sabor vainilla Begetal Kaiku sin lactosa pack de 2 unidades de 115 g.,Pack 2x115 G.,1.85,8.04,kg,2020-11-23 12:00:00
ADCA3FE6444F01A88B191BBCD4249311,congelados_y_helados_platos_precocinados_base_arroz_y_salteados,DIA arroz 3 delicias con marisco bolsa 700 gr,,1.75,2.5,€/Kg.,2020-11-01 00:00:00
ADCA3FE6444F01A88B191BBCD4249311,frescos_verdura_y_hortalizas_hierbas_aromaticas,Cilantro 20 gr,,0.99,49.5,€/Kg.,2020-09-13 16:00:00
885EA3C1F14BDAE3193991E63BF5CFA4,mascotas_gato,Bocaditos en gelatina gato adulto Delikuit,Paquete,1.2,3.0,kg,2020-12-22 00:00:00
433463D95980C252B92C204E3655BB81,la_despensa_lacteos_nata,Nata para montar líquida Carrefour 500 ml.,,0.99,1.98,l,2021-01-08 00:00:00
433463D95980C252B92C204E3655BB81,la_despensa_cestas_y_lotes_perfumeria_para_regalar,"Cesta metálica Cherrry Blossom: Gel 220 ml, Loción 220 ml, Exfoliante 50 ml, sales 100 g una vela y esponja",6 Ud.,13.4,13.4,ud,2020-12-13 01:00:00
433463D95980C252B92C204E3655BB81,el_mercado_verduras_y_hortalizas_tomates_y_pepinos,Tomate mini cherry rama 200 g,200 G,2.0,10.0,kg,2020-11-07 00:00:00
433463D95980C252B92C204E3655BB81,la_despensa_alimentacion_salsas_y_tomate_frito,Salsa alioli Ybarra sin gluten y sin lactosa tarro 225 ml.,225 Ml.,1.09,4.84,l,2020-11-01 12:00:00
433463D95980C252B92C204E3655BB81,bebidas_vinos_todos_los_vinos,Protos Verdejo Blanco 2019,,6.5,6.5,ud,2021-01-22 00:00:00
885EA3C1F14BDAE3193991E63BF5CFA4,marisco_y_pescado_marisco,Colas de gambón peladas Hacendado ultracongeladas,Bandeja,5.5,22.0,kg,2021-01-22 12:00:00
ADCA3FE6444F01A88B191BBCD4249311,drogueria_y_limpieza_lavavajillas_a_mano,FLOTA lavavajillas mano formula mejorada botella 1250 ml,,1.3,1.04,€/l.,2020-12-16 04:00:00
433463D95980C252B92C204E3655BB81,bebe_bio_en_bebe,Tarrito de verduritas con pavo desde 6 meses ecológico Carrefour Baby Bio pack de 2 unidades de 200 g,Pack 2x200 G.,2.3,5.75,kg,2020-10-13 00:00:00
433463D95980C252B92C204E3655BB81,el_mercado_pescaderia_bio_en_pescaderia,Langostino crudo ecológico Carrefour Bio 700 g.,700 G.,8.2,11.71,kg,2020-10-22 00:00:00
433463D95980C252B92C204E3655BB81,la_despensa_dulce_y_desayuno_mermeladas_membrillos_y_compotas,Compota de manzana Carrefour Kids pack de 4 unidades de 90 g.,Pack 4x90 G.,1.55,4.31,kg,2020-10-22 15:00:00
433463D95980C252B92C204E3655BB81,la_despensa_conservas_sopas_y_precocinados_conservas_de_pescado_y_marisco,Calamares en salsa americana Calvo pack de 3 unidades de 48 g.,,2.1,14.58,kg,2021-01-27 00:00:00
433463D95980C252B92C204E3655BB81,bebidas_cerveza_rubia,Cerveza San Miguel especial Lager pack de 28 latas de 33 cl.,,14.56,1.58,l,2021-01-11 00:00:00
433463D95980C252B92C204E3655BB81,la_despensa_cestas_y_lotes_perfumeria_para_regalar,Agua de colonia Colección Sensual nº 10 Vainilla Seductora Victorio & Lucchino 150 ml.,,10.05,6.7,100ml,2020-12-27 12:00:00
885EA3C1F14BDAE3193991E63BF5CFA4,charcuteria_y_quesos_aves_y_jamon_cocido,Pechuga de pollo Hacendado al corte,Paquete,1.6,8.0,kg,2020-07-27 17:36:00
433463D95980C252B92C204E3655BB81,la_despensa_yogures_y_postres_otros_postres,Crema catalana Carrefour pack de 2 unidades de 100g.,,1.56,7.8,kg,2021-01-03 12:00:00
885EA3C1F14BDAE3193991E63BF5CFA4,huevos_leche_y_mantequilla_leche_y_bebidas_vegetales,Batido sabor vainilla Hacendado,Botella,0.85,0.85,L,2020-11-13 00:00:00
ADCA3FE6444F01A88B191BBCD4249311,desayuno_dulces_y_pan_preparacion_de_postres_decoracion_y_complementos_para_postres,LA LECHERA topping de chocolate bote 450 gr,,2.95,6.56,€/Kg.,2020-08-01 04:00:00
433463D95980C252B92C204E3655BB81,bebidas_vinos_todos_los_vinos,Vino D.O. Penedés blanco Gessamí Gramona 75 cl.,75 Cl.,11.25,11.25,ud,2020-12-13 12:00:00
433463D95980C252B92C204E3655BB81,el_mercado_charcuteria_salchichas,Salchichas de tofu al estilo frankfurt ecológicas Gerblé Bio 280 g.,280 G.,5.25,18.75,kg,2020-12-01 00:00:00
ADCA3FE6444F01A88B191BBCD4249311,perfumeria_e_higiene_limpieza_facial_limpieza_desmaquilladores,VITESSE agua micelar 3 en 1 todo tipo de pieles bote 400 ml,,3.99,9.98,€/l.,2020-11-22 00:00:00
885EA3C1F14BDAE3193991E63BF5CFA4,panaderia_y_pasteleria_bolleria_envasada,Palmera de cacao Hacendado sin azúcar añadido,,0.34,3.75,kg,2020-10-06 00:00:00
885EA3C1F14BDAE3193991E63BF5CFA4,postres_y_yogures_yogures_liquidos,Bebida láctea natural L-casei 0% materia grasa 0% azúcares añadidos,Pack-6,1.5,2.5,kg,2020-08-23 16:00:00
433463D95980C252B92C204E3655BB81,bebidas_vinos_generosos_y_dulces,Mistela Moscatel La Cartuja 75 cl.,75 Cl.,2.65,2.65,ud,2020-10-16 13:00:00
885EA3C1F14BDAE3193991E63BF5CFA4,marisco_y_pescado_pescado_fresco,Lubina sin limpiar,Pieza,2.85,6.95,kg,2020-08-12 16:00:00
885EA3C1F14BDAE3193991E63BF5CFA4,panaderia_y_pasteleria_tartas_y_pasteles,Roscón de Reyes relleno de preparado a base de nata y cacao,Caja,8.0,10.0,kg,2020-11-16 12:00:00
885EA3C1F14BDAE3193991E63BF5CFA4,limpieza_y_hogar_lejia_y_liquidos_fuertes,Aguarrás símil Bosque Verde,Botella,1.6,3.2,L,2020-07-23 16:00:00
885EA3C1F14BDAE3193991E63BF5CFA4,limpieza_y_hogar_papel_higienico_y_celulosa,Papel higiénico húmedo WC Bosque Verde,Paquete,1.5,0.02,ud,2020-12-30 00:00:00
433463D95980C252B92C204E3655BB81,la_despensa_dulce_y_desayuno_cafes,"Café espresso tostado en cápsulas Starbucks compatible con Nespresso 10 unidades de 5,7 g.",10 Ud.,3.84,67.37,kg,2020-10-23 12:00:00
433463D95980C252B92C204E3655BB81,bebidas_alcoholes_vermouth,Vermut Yzaguirre rojo 1 l.,,6.9,6.9,l,2021-01-12 00:00:00
885EA3C1F14BDAE3193991E63BF5CFA4,cuidado_facial_y_corporal_protector_solar_y_aftersun,Protector solar niños Nivea FPS 50+,Spray,11.85,3.95,100 ml,2020-08-10 04:00:00
ADCA3FE6444F01A88B191BBCD4249311,perfumeria_e_higiene_cuidado_facial_protector_labial,BONTE vaselina perfumada tarro 15 gr,,1.65,110.0,€/Kg.,2020-10-08 12:01:00
885EA3C1F14BDAE3193991E63BF5CFA4,cuidado_facial_y_corporal_manicura_y_pedicura,Laca de uñas alto brillo Deliplus 40 mora natural,,2.5,22.73,100 ml,2020-08-11 04:00:00
433463D95980C252B92C204E3655BB81,limpieza_y_hogar_productos_para_cocina_lavavajillas_a_maquina,Lavavajillas a máquina en pastillas todo en 1 pack XL Somat 50 ud.,,8.03,0.16,ud,2021-01-18 12:00:00
433463D95980C252B92C204E3655BB81,parafarmacia_nutricion_y_dietetica_batidos_e_infusiones,Batido sustitutivo sabor vainilla Bimanán 330 ml.,330 Ml.,3.05,9.24,l,2020-10-23 00:00:00
433463D95980C252B92C204E3655BB81,perfumeria_e_higiene_bano_e_higiene_corporal_bio_en_bano_e_higiene_corporal,Gel de ducha Bio-Pineapple & Lemon ecológico Sante 500 ml.,500 Ml.,9.4,1.88,100 ml,2020-11-23 12:00:00
885EA3C1F14BDAE3193991E63BF5CFA4,cuidado_del_cabello_champu,Champú Volumen Deliplus cabello fino y sin volumen,Bote,1.8,0.45,100 ml,2020-10-06 00:00:00
433463D95980C252B92C204E3655BB81,el_mercado_panaderia_bolleria_y_pasteleria_bolleria_tradicional,Red calabazas Halloween Dillepasa 100 g,Envase De,1.8,18.0,kg,2020-11-02 12:00:00
885EA3C1F14BDAE3193991E63BF5CFA4,carne_cerdo,Media careta de cerdo sin oreja,Bandeja,1.66,3.95,kg,2020-11-01 12:00:00
433463D95980C252B92C204E3655BB81,la_despensa_conservas_sopas_y_precocinados_pizzas,Pizza de jamón y queso Carrefour 400 g.,,1.99,4.97,kg,2020-12-20 01:00:00
ADCA3FE6444F01A88B191BBCD4249311,frescos_pescado_y_marisco_pescado_fresco_azul,DIA SELECCIÓN MUNDIAL salmón ahumado sobre 100 gr,,3.69,36.9,€/Kg.,2021-01-26 00:00:00
433463D95980C252B92C204E3655BB81,la_despensa_dulce_y_desayuno_galletas,Galletas María dorada Carrefour 800 g.,,0.9,1.12,kg,2021-01-24 00:00:00
433463D95980C252B92C204E3655BB81,parafarmacia_bebe_puericultura,Chupete anatómico de látex 6-18 meses Nuk Disney 2 ud.,2 Ud.,5.25,2.62,ud,2020-07-26 04:00:00
433463D95980C252B92C204E3655BB81,parafarmacia_bebe_leche_infantil,Leche infantil desde 1 año Enfamil Premium 3 lata 800 g.,800 G.,17.5,21.88,kg,2020-10-28 12:00:00
ADCA3FE6444F01A88B191BBCD4249311,perfumeria_e_higiene_colonias_familiar,NATURAL HONEY colonia frescor de colonia spray 150 ml,,2.75,18.33,€/l.,2020-12-13 01:00:00
433463D95980C252B92C204E3655BB81,el_mercado_carniceria_vacuno,Filete de novillo 1ªB de Irlanda Carrefour 700 g aprox,Envase De 700.0 G. Aprox,7.14,10.2,kg,2020-12-05 00:00:00
433463D95980C252B92C204E3655BB81,limpieza_y_hogar_calzado_plantillas_de_calzado,Plantillas deportivas Carrefour 1 par.,2 Ud.,2.2,2.2,ud,2020-12-15 00:00:00
ADCA3FE6444F01A88B191BBCD4249311,perfumeria_e_higiene_higiene_sexual_lubricantes,BONTE gel lubricante up fresa bote 75 ml,,5.75,76.67,€/l.,2020-11-26 00:00:00
433463D95980C252B92C204E3655BB81,la_despensa_alimentacion_pastas,Espaguetis integrales Carrefour 500 g.,,0.82,1.64,kg,2020-12-31 12:00:00
885EA3C1F14BDAE3193991E63BF5CFA4,cuidado_facial_y_corporal_perfume_y_colonia,Lote hombre Como tú Fuerza,Caja,9.0,9.0,ud,2021-01-03 00:00:00
ADCA3FE6444F01A88B191BBCD4249311,perfumeria_e_higiene_cuidado_del_cabello_tintes_y_coloracion,COLORCREM tinte Rubio Caramelo Nº 79 caja 1 ud,,4.99,4.99,€/ud.,2021-01-17 12:00:00
433463D95980C252B92C204E3655BB81,bebidas_cava_y_champagne_todos_los_cavas_y_champagnes,Cava Freixenet Cordón Negro Gran Selección semiseco 75 cl.,,6.35,6.35,ud,2021-01-15 12:00:00
885EA3C1F14BDAE3193991E63BF5CFA4,huevos_leche_y_mantequilla_mantequilla_y_margarina,Margarina con sal Hacendado,Tarrina,0.8,1.6,kg,2020-10-05 00:00:00
ADCA3FE6444F01A88B191BBCD4249311,lacteos_y_huevos_horchatas_horchatas,DIA yogur plátano pack 4 unidades 125 g,,0.55,1.1,€/Kg.,2020-12-16 04:00:00
ADCA3FE6444F01A88B191BBCD4249311,frescos_verdura_y_hortalizas_pimiento,Pimiento rojo unidad (390 gr aprox.),,0.58,1.49,€/Kg.,2020-12-03 12:00:00
433463D95980C252B92C204E3655BB81,la_despensa_conservas_sopas_y_precocinados_gazpacho_y_salmorejo,Gazpacho fresco con aceite de oliva virgen extra García Millán 330 ml.,,1.05,3.18,l,2021-01-02 00:00:00
433463D95980C252B92C204E3655BB81,parafarmacia_higiene_bucal_pasta_de_dientes,Dentífrico Lacer Fresh 125 ml.,,4.95,3.96,100ml,2021-01-10 00:00:00
433463D95980C252B92C204E3655BB81,la_despensa_dulce_y_desayuno_chocolates_turrones_y_bombones,Bombones surtidos Golden Gallery Ferrero 22 ud.,22 Ud.,8.35,40.34,kg,2020-11-16 12:00:00
433463D95980C252B92C204E3655BB81,el_mercado_charcuteria_jamon_serrano_e_iberico_envasado,Paleta ibérica de cebo en lonchas Carrefour Calidad y Origen 100 g,100 G,5.9,59.0,kg,2020-11-06 12:00:00
433463D95980C252B92C204E3655BB81,bebidas_vinos_vinos_internacionales,Vino Lambrusco blanco Amabile dell' Emilia Bautista Marti 75 cl.,75 Cl.,2.65,2.65,ud,2020-10-22 15:00:00
ADCA3FE6444F01A88B191BBCD4249311,frescos_pescado_y_marisco_marisco_fresco,Gallo mediano limpio y entero unidad (peso aprox. 600 gr),,7.19,11.99,€/Kg.,2020-09-19 04:00:00
ADCA3FE6444F01A88B191BBCD4249311,perfumeria_e_higiene_higiene_bucal_cepillos_de_dientes,COLGATE cabezal de recambio whole mouth clean 360º blíster 2 uds,,6.45,3.23,€/ud.,2020-12-17 10:00:00
885EA3C1F14BDAE3193991E63BF5CFA4,bodega_sidra_y_cava,Cava semi seco Cabré & Sabaté,Pack-4,4.35,5.44,L,2020-07-26 04:00:00
ADCA3FE6444F01A88B191BBCD4249311,productos_sin_gluten_productos_sin_gluten_productos_sin_gluten,ESGIR Crunchy crumbs rebozado crujiente SIN GLUTEN bolsa 200 gr,,1.55,7.75,€/Kg.,2020-07-22 16:00:00
433463D95980C252B92C204E3655BB81,el_mercado_pescaderia_bacalao_y_salazones,Lomos de bacalao congelado Skrei Calidad y Origen Carrefour 360 g,360 G.,8.99,24.97,kg,2020-10-16 12:00:00
885EA3C1F14BDAE3193991E63BF5CFA4,azucar_caramelos_y_chocolate_chocolate,Barritas de barquillo Kinder Bueno bañadas de chocolate con leche,Pack-3,2.25,17.44,kg,2020-09-19 16:00:00
433463D95980C252B92C204E3655BB81,limpieza_y_hogar_menaje_ordenacion,Caja con Tapa de Plástico Basic CARREFOUR HOME 70 Litros - Transparente,1 Ud,12.0,12.0,ud,2020-12-07 00:00:00
ADCA3FE6444F01A88B191BBCD4249311,desayuno_dulces_y_pan_pan_pan_fresco,Barra de pan baguette semillas 250 gr,,0.79,3.16,€/Kg.,2020-10-05 00:00:00
ADCA3FE6444F01A88B191BBCD4249311,perfumeria_e_higiene_botiquin_algodon_bastoncillos,BEL Baby gasas faciales infantiles bolsa 100 uds,,2.39,2.39,€/ud.,2020-08-07 04:00:00
433463D95980C252B92C204E3655BB81,bebidas_vinos_tinto,Vino D.O. Ribera del Duero tinto Emilio Moro 50 cl.,50 Cl.,11.85,11.85,ud,2020-11-27 00:00:00
885EA3C1F14BDAE3193991E63BF5CFA4,zumos_melocoton_y_pina,Néctar de melocotón La Verja,Botella,1.19,0.79,L,2020-11-04 12:00:00
885EA3C1F14BDAE3193991E63BF5CFA4,fruta_y_verdura_verdura,Zanahoria rallada base para ensalada,Paquete,0.75,5.0,kg,2020-10-24 00:00:00
433463D95980C252B92C204E3655BB81,limpieza_y_hogar_papel_y_celulosa_papel_cocina_y_multiusos,Papel de cocina ultra absorbente XXL Carrefour 4 r.,4 R.,3.89,0.97,ud,2020-11-22 12:00:00
885EA3C1F14BDAE3193991E63BF5CFA4,carne_vacuno,Churrasco de vacuno añojo,Bandeja,3.45,6.9,kg,2020-09-20 16:00:00
433463D95980C252B92C204E3655BB81,el_mercado_pescaderia_pescado_fresco,Lomo de atún 300 g aprox,300 G Aprox 300.0 G. Aprox,3.12,,,2020-07-21 16:00:00
433463D95980C252B92C204E3655BB81,la_despensa_alimentacion_harinas_y_levaduras,Harina de trigo integral ecológica Carrefour 500 g.,,0.87,1.74,kg,2021-01-17 12:00:00
ADCA3FE6444F01A88B191BBCD4249311,drogueria_y_limpieza_limpiadores_para_el_hogar_limpia_banos,SANYTOL limpiador desinfectante baños pistola 750 ml,,2.49,3.32,€/l.,2021-01-27 00:00:00
433463D95980C252B92C204E3655BB81,limpieza_y_hogar_cuidado_de_la_ropa_detergentes,Detergente en polvo Active Clean Skip 90 cacitos.,90 Cacitos.,15.75,0.18,lavado,2020-10-23 12:00:00
885EA3C1F14BDAE3193991E63BF5CFA4,charcuteria_y_quesos_queso_curado_semicurado_y_tierno,Queso de cabra tierno Montesinos,Pieza,3.27,10.9,kg,2020-10-09 12:00:00
433463D95980C252B92C204E3655BB81,el_mercado_quesos_queso_fresco,Queso blanco pasteurizado natural Carrefour pack de 2 unidades de 250 g.,Pack De 2x250 G.,1.59,,,2020-07-19 16:00:00
433463D95980C252B92C204E3655BB81,la_despensa_dulce_y_desayuno_infusiones_y_tes,Infusión lipoacción en bolsitas Pompadour 20 ud.,20 Ud.,2.15,48.86,kg,2020-10-25 13:00:00
433463D95980C252B92C204E3655BB81,la_despensa_yogures_y_postres_natillas_cremas_y_copas,Natillas de chocolate Carrefour pack de 4 unidades de 125 g.,Pack 4x125 G.,0.69,1.38,kg,2020-10-19 13:00:00
433463D95980C252B92C204E3655BB81,la_despensa_dulce_y_desayuno_cremas_de_cacao_avellana_y_cacahuete,Dulce de leche pastelero Mardel 450 g.,450 G.,2.91,6.47,kg,2020-10-16 12:00:00
ADCA3FE6444F01A88B191BBCD4249311,perfumeria_e_higiene_depilacion_maquinillas_y_recambios,WILKINSON Sword intuition fab maquinilla de afeitar mujer recambio 3 uds,,9.59,3.2,€/ud.,2021-01-26 00:00:00
ADCA3FE6444F01A88B191BBCD4249311,perfumeria_e_higiene_cuidado_manos_crema_de_manos,NIVEA crema de manos aceite de oliva tubo 100ml,,2.09,20.9,€/l.,2020-08-13 04:00:00
885EA3C1F14BDAE3193991E63BF5CFA4,azucar_caramelos_y_chocolate_chocolate,Chocolate con leche Nestlé,Tableta,0.9,7.2,kg,2020-12-23 17:00:00
433463D95980C252B92C204E3655BB81,la_despensa_aperitivos_frutos_secos,Avellana repelada tostada sin sal Carrefour tarrina 225 g,,3.95,17.56,kg,2021-01-10 12:00:00
433463D95980C252B92C204E3655BB81,la_despensa_conservas_sopas_y_precocinados_caldos_sopas_y_pure,Puré de patatas Maggi sin gluten 230 g.,,1.73,7.52,kg,2020-12-27 12:00:00
885EA3C1F14BDAE3193991E63BF5CFA4,aceite_especias_y_salsas_otras_salsas,Salsa pimienta verde Hacendado,Sobre,0.75,15.0,kg,2021-01-06 13:00:00
433463D95980C252B92C204E3655BB81,la_despensa_dulce_y_desayuno_azucar_y_edulcorantes,Edulcorante de mesa Stevia Carrefour 100 ud.,100 Ud.,1.0,0.01,ud,2020-11-05 13:00:00
885EA3C1F14BDAE3193991E63BF5CFA4,fitoterapia_y_parafarmacia_fitoterapia,Ampollas lipo reductor Deliplus,Caja,3.95,3.29,100 ml,2020-09-24 00:00:00
433463D95980C252B92C204E3655BB81,perfumeria_e_higiene_cabello_champus,Champú suave y liso para cabello encrespado o apagado Pantene 700 ml.,,5.85,0.84,100ml,2020-12-21 12:00:00
433463D95980C252B92C204E3655BB81,perfumeria_e_higiene_boca_y_sonrisa_dentifricos,Dentífrico 2 en 1 Blanqueador avanzado Licor del Polo 75 ml.,,1.82,2.43,100ml,2021-01-02 00:00:00
433463D95980C252B92C204E3655BB81,limpieza_y_hogar_papeleria_folios_y_papeles_especiales,Paquete 250 Hojas Navigator Color 120 gr DIN A4,1 Ud,4.99,4.99,ud,2020-12-08 12:00:00
433463D95980C252B92C204E3655BB81,perfumeria_e_higiene_cuidado_y_proteccion_corporal_limpieza_facial,Agua micelar en aceite Garnier 400 ml.,,4.75,1.19,100ml,2021-01-04 00:00:00
433463D95980C252B92C204E3655BB81,el_mercado_quesos_con_denominacion_origen,Queso curado grattugia facile Biraghi 200 g,200 G,3.95,19.75,kg,2020-10-29 15:00:00
433463D95980C252B92C204E3655BB81,el_mercado_verduras_y_hortalizas_bio_en_verduras_y_hortalizas,Romero ecológico Carrefour Bio maceta 1 ud,Envase De,1.39,1.39,ud,2020-10-08 12:01:00
433463D95980C252B92C204E3655BB81,la_despensa_conservas_sopas_y_precocinados_conservas_de_tomate,Tomate listo para untar con aceite oliva ecológico Pedro Luis 235 g.,235 G.,2.49,10.6,kg,2020-10-24 12:00:00
433463D95980C252B92C204E3655BB81,perfumeria_e_higiene_bano_e_higiene_corporal_colonias,Colonia cherry I'm Free 100 ml,,4.75,4.32,100 ml,2020-10-25 13:00:00
